"B6C1826924";;"CONSIP_ORDINE_8530168";"PROGETTAZIONE E IMPLEMENTAZIONE NELL AMBITO DELLA PIATTAFORMA DI ACCESSO INTEGRATA DI SERVIZI DI INTELLIGENZA ARTIFICIALE E DI FUNZIONALITA DI INTERFACCIA E INTEGRAZIONE CON I SERVIZI DEL NUCLEO TECNOLOGICO ABILITANTE DELL ECOSISTEMA APPLICATIVO ECOMIC";"7999995.0";"1";"SERVIZI DI SUPPORTO NELLA PROGETTAZIONE E IMPLEMENTAZIONE DI SERVIZI DI INTELLIGENZA ARTIFICIALE E DI FUNZIONALITÀ DI INTERFACCIA E INTEGRAZIONE CON I SERVIZI DEL NUCLEO TECNOLOGICO ABILITANTE DELL ECOSISTEMA DEL MINISTERO";"7999995.0";"SERVIZI";"ATTIVO";"SETTORI ORDINARI";"058091";"ROMA";"2025-05-07";"2025-05-07";"24";"AFFIDAMENTO DIRETTO";"11";"CONTRATTO D'APPALTO DISCENDENTE DA ACCORDO QUADRO/CONVENZIONE SENZA SUCCESSIVO CONFRONTO COMPETITIVO";"0000628471";"96452070582";"ISTITUTO CENTRALE PER LA DIGITALIZZAZIONE DEL PATRIMONIO CULTURALE -DIGITAL LIBRARY";"NON CLASSIFICATO";"C1770E90-FDDD-436C-AF3C-BF19DE9875B5";"ISTITUTO CENTRALE PER LA DIGITALIZZAZIONE DEL PATRIMONIO CULTURALE - DIGITAL LIBRARY";"2025";"5";"72000000-5";"SERVIZI INFORMATICI: CONSULENZA, SVILUPPO DI SOFTWARE, INTERNET E SUPPORTO";"1";;;;"2025-05-07";;;;;;;;"0";;;"0";;"96452070582";"ISTITUTO CENTRALE PER LA DIGITALIZZAZIONE DEL PATRIMONIO CULTURALE -DIGITAL LIBRARY";;;;;;;;;;"1.0";"AGGIUDICATA";"2025-05-07";"0"
"B6C2CB5051";"A0259125A9";"CONSIP_ORDINE_8510469";"PROGETTO POTENZIALITÀ E SFIDE DELL'INTELLIGENZA ARTIFICIALE PR FSE+ 2021-2027";"160010.0";"1";"SERVIZI PER LA PROMOZIONE DELLE CONOSCENZE E COMPETENZE DIGITALI IN MATERIA DI INTELLIGENZA ARTIFICIALE";"160010.0";"SERVIZI";"ATTIVO";"SETTORI ORDINARI";"007003";"AOSTA";"2025-05-07";"2025-05-07";"24";"AFFIDAMENTO DIRETTO";"11";"CONTRATTO D'APPALTO DISCENDENTE DA ACCORDO QUADRO/CONVENZIONE SENZA SUCCESSIVO CONFRONTO COMPETITIVO";"0000246415";"80002270074";"REGIONE AUTONOMA VALLE D'AOSTA";"SEZIONE REGIONALE VALLE D'AOSTA";"09C6B257-1F36-4EEC-8A60-9B3740FC2C71";"DIPARTIMENTO INNOVAZIONE E AGENDA DIGITALE";"2025";"5";"72000000-5";"SERVIZI INFORMATICI: CONSULENZA, SVILUPPO DI SOFTWARE, INTERNET E SUPPORTO";"1";;;;"2025-05-07";;;;;;;;"0";;;"0";;"80002270074";"REGIONE AUTONOMA VALLE D'AOSTA";;;;;;;;;;"1.0";"AGGIUDICATA";"2025-05-07";"0"
"B6C39A8FEC";"9188224A4D";"CONSIP_ORDINE_8431147";"SISTEMA PER IL GOVERNO DEI DATI TRAMITE APPLICAZIONI DI AI";"56036.5";"1";"ATTIVITÀ DI SVILUPPO SOFTWARE INTELLIGENZA ARTIFICIALE PER LA DIAGNOSI DEGLI ESAMI RX";"56036.5";"SERVIZI";"ATTIVO";"SETTORI ORDINARI";"015146";"MILANO";"2025-05-08";"2025-05-08";"24";"AFFIDAMENTO DIRETTO";"11";"CONTRATTO D'APPALTO DISCENDENTE DA ACCORDO QUADRO/CONVENZIONE SENZA SUCCESSIVO CONFRONTO COMPETITIVO";"0000219283";"04724150968";"FONDAZIONE IRCCS CA GRANDA OSPEDALE MAGGIORE POLICLINICO";"SEZIONE REGIONALE LOMBARDIA";"35208095-A3AB-4A36-BBF4-6EB508FFA7EB";"U.O. SISTEMI INFORMATIVI ED INFORMATICI";"2025";"5";"72262000-9";"SERVIZI DI SVILUPPO DI SOFTWARE";"1";;;;"2025-05-08";;;;;;;;"0";;;"0";;"04724150968";"FONDAZIONE IRCCS CA' GRANDA OSPEDALE MAGGIORE POLICLINICO";;;;;;;;;;"1.0";"AGGIUDICATA";"2025-05-08";"1"
"B6C425F105";;"CONSIP_ORDINE_8536987";"SERVIZIO DI ORGANIZZAZIONE DI UNA SUMMER SCHOOL PER IL PHD IN INTELLIGENZA ARTIFICIALE SUI TEMI DI AI & DEMOCRACY CHE SI TERRÀ A PISA DAL 5 GIUGNO AL 10 GIUGNO 2025";"59000.0";"1";"SERVIZIO DI ORGANIZZAZIONE DI UNA SUMMER SCHOOL PER IL PHD IN AI";"59000.0";"SERVIZI";"ATTIVO";"SETTORI ORDINARI";"050026";"PISA";"2025-05-09";"2025-05-08";"24";"AFFIDAMENTO DIRETTO";"1";"CONTRATTO D'APPALTO";"0000236747";"80003670504";"UNIVERSITA DI PISA";"SEZIONE REGIONALE CENTRALE";"26A473E7-0270-4D92-AA30-6D27F41943BE";"DIPARTIMENTO DI INFORMATICA";"2025";"5";"80500000-9";"SERVIZI DI FORMAZIONE";"1";;;;"2025-05-08";;;;;;;;"1";"7.0";"non applicabile";"0";;"80003670504";"UNIVERSITA' DI PISA";;;"2000.0";;;;;;;"1.0";"AGGIUDICATA";"2025-05-08";"1"
"B6CC400A23";;"53b326d0-79d5-461d-8db8-f6d45868d2f0";"PROCEDURA DI AFFIDAMENTO PER L'ESECUZIONE DEL SERVIZIO DI ANALISI CAMPIONI PER L'ENUMERAZIONE DELLE CELLULE CIRCOLANTI NECESSARIO ALLE ATTIVITÀ DI RICERCA LEGATE AL PROGETTO AIMMER: A MACHINE LEARNING APPROACH TO CONNECT MULTIPLE MYELOMA COMPLEXITY TO EARLY DISEASE RECURRENCE FINANZIATO CON I FONDI DEL PIANO NAZIONALE DI RIPRESA E RESILIENZA - MISSIONE M6 - COMPONENTE C2 - INVESTIMENTO 2.1 VALORIZZAZIONE E POTENZIAMENTO DELLA RICERCA BIOMEDICA DEL SSN - NEXTGENERATIONEU_ CODICE PROGETTO PNRR-TR1-2023-12378246 CUP F33C24000200006 ";"24223.0";"1";"PROCEDURA DI AFFIDAMENTO PER L'ESECUZIONE DEL SERVIZIO DI ANALISI CAMPIONI PER L'ENUMERAZIONE DELLE CELLULE CIRCOLANTI NECESSARIO ALLE ATTIVITÀ DI RICERCA LEGATE AL PROGETTO AIMMER: A MACHINE LEARNING APPROACH TO CONNECT MULTIPLE MYELOMA COMPLEXITY TO EARLY DISEASE RECURRENCE FINANZIATO CON I FONDI DEL PIANO NAZIONALE DI RIPRESA E RESILIENZA - MISSIONE M6 - COMPONENTE C2 - INVESTIMENTO 2.1 VALORIZZAZIONE E POTENZIAMENTO DELLA RICERCA BIOMEDICA DEL SSN - NEXTGENERATIONEU_ CODICE PROGETTO PNRR-TR1-2023-12378246 CUP F33C24000200006 ";"24223.0";"FORNITURE";"ATTIVO";"SETTORI ORDINARI";"037006";"BOLOGNA";"2025-05-12";"2025-05-09";"24";"AFFIDAMENTO DIRETTO";"1";"CONTRATTO D'APPALTO";"0000244701";"92038610371";"AZ.OSPEDALIERO UNIVERSITARIA DI BOLOGNA - POLICLINICO S.ORSOLA MALPIGHI";"SEZIONE REGIONALE EMILIA ROMAGNA";"F65B623E-F2BE-4A99-B1C7-E86F97A5BC7D";"DIREZIONE TECNOLOGIE BIOMEDICHE";"2025";"5";"85111810";;"1";;;;"2025-05-09";;;;;;;;"1";"7.0";"non applicabile";"0";;"92038610371";"AZ. OSP. UNIV. S.ORSOLA-MALPIGHI";;;"0.0";;;;;;;"1.0";"AGGIUDICATA";"2025-05-09";"1"
"B6D01CDA0A";;"tender://rse_web/id/1673";"FORNITURA DI UN SISTEMA DI INTELLIGENZA ARTIFICIALE PER IL SUPPORTO DELLA RICERCA GIURIDICA.";"25000.0";"1";"FORNITURA DI UN SISTEMA DI INTELLIGENZA ARTIFICIALE PER IL SUPPORTO DELLA RICERCA GIURIDICA.";"25000.0";"SERVIZI";"ATTIVO";"SETTORI ORDINARI";"015146";"MILANO";"2025-05-13";"2025-05-12";"24";"AFFIDAMENTO DIRETTO";"1";"CONTRATTO D'APPALTO";"0000222557";"05058230961";"RICERCA SUL SISTEMA ENERGETICO - RSE S.P.A.";"SEZIONE REGIONALE CENTRALE";"C684F689-0167-4ACF-8EA5-7BC91119DAE1";"LEG";"2025";"5";"79000000-4";"SERVIZI PER LE IMPRESE: SERVIZI GIURIDICI, DI MARKETING, DI CONSULENZA, DI RECLUTAMENTO, DI STAMPA E DI SICUREZZA";"1";;;;"2025-05-12";;;;;;;;"1";"7.0";"non applicabile";"0";;"05058230961";"RICERCA SUL SISTEMA ENERGETICO - RSE S.P.A.";;;;;;;;;;"1.0";"AGGIUDICATA";"2025-05-12";"0"
"B6D2D2E62E";;"CONSIP_RDO_5332393";"FORMAZIONE PNRR POLI FORMATIVI 7 - 9 MAGGIO 2025";"8595.0";"1";"‘‘GENAI E I LIBRI DI TESTO: COME CAMBIA LA DIDATTICA AL TEMPO DELL'INTELLIGENZA ARTIFICIALE'; DAL 7 AL 9 MAGGIO 2025";"8595.0";"SERVIZI";"ATTIVO";"SETTORI ORDINARI";"051002";"AREZZO";"2025-05-13";"2025-05-12";"24";"AFFIDAMENTO DIRETTO";"1";"CONTRATTO D'APPALTO";"0000319360";"80001560517";"CONVITTO NAZIONALE VITTORIO EMANUELE II DI AREZZO";"SEZIONE REGIONALE CENTRALE";"D998B0E9-8E1C-4AFB-9511-2DD27CE2EA76";"UFFICIO ECONOMATO";"2025";"5";"80570000-0";"SERVIZI DI PERFEZIONAMENTO PERSONALE";"1";;;;"2025-05-12";;;;;;;;"1";"7.0";"non applicabile";"0";;"80001560517";"CONVITTO NAZIONALE VITTORIO EMANUELE II DI AREZZO";;;;;;;;;;"1.0";"AGGIUDICATA";"2025-05-12";"0"
"B6D2DC1F7A";;"G08241-97dc9cc7-b51a-4336-9a57-3b85c89b1d7b";"ACQUISTO MEDIANTE AFFIDAMENTO DIRETTO AI SENSI DELL ART. 50, COMMA 1, LETT. B) DEL D.LGS. 36/2023 A SEGUITO DI INDAGINE ESPLORATIVA DI MERCATO SU PIATTAFORMA U-BUY FINALIZZATA AD ACQUISIRE ATTREZZATURA SCIENTIFICA: FOTOLETTORE TECAN INFINITE 200 PRO M PLEX , PER LE ESIGENZE DEL PROGRAMMA DI RICERCA DAL TITOLO: ARTIFICIAL INTELLIGENCE-BASED DENGUE VIRUS INFECTION PREDICTOR (AI-DENINFECT),A VALERE SULLE RISORSE DEL PIANO NAZIONALE RIPRESA E RESILIENZA (PNRR) BANDO A CASCATA COC-2-2024-UNIPV MISSIONE 4 ISTRUZIONE E RICERCA - COMPONENTE 2, DALLA RICERCA ALLIMPRESA - LINEA DI INVESTIMENTO 1.3, FINANZIATO DALLUNIONE EUROPEA NEXTGENERATION EU CUP: D93C24001570007 ";"34497.0";"1";"ACQUISTO MEDIANTE AFFIDAMENTO DIRETTO AI SENSI DELL ART. 50, COMMA 1, LETT. B) DEL D.LGS. 36/2023 A SEGUITO DI INDAGINE ESPLORATIVA DI MERCATO SU PIATTAFORMA U-BUY FINALIZZATA AD ACQUISIRE ATTREZZATURA SCIENTIFICA: FOTOLETTORE TECAN INFINITE 200 PRO M PLEX , PER LE ESIGENZE DEL PROGRAMMA DI RICERCA DAL TITOLO: ARTIFICIAL INTELLIGENCE-BASED DENGUE VIRUS INFECTION PREDICTOR (AI-DENINFECT),A VALERE SULLE RISORSE DEL PIANO NAZIONALE RIPRESA E RESILIENZA (PNRR) BANDO A CASCATA COC-2-2024-UNIPV MISSIONE 4 ISTRUZIONE E RICERCA - COMPONENTE 2, DALLA RICERCA ALLIMPRESA - LINEA DI INVESTIMENTO 1.3, FINANZIATO DALLUNIONE EUROPEA NEXTGENERATION EU CUP: D93C24001570007 ";"34497.0";"FORNITURE";"ATTIVO";"SETTORI ORDINARI";"063049";"NAPOLI";"2025-05-14";"2025-05-12";"24";"AFFIDAMENTO DIRETTO";"1";"CONTRATTO D'APPALTO";"0000194351";"02044190615";"UNIVERSITA DEGLI STUDI DELLA CAMPANIA LUIGI VANVITELLI";"SEZIONE REGIONALE CENTRALE";"009B3322-4F0E-47FA-AA38-80B656109887";"DIPARTIMENTO DI MEDICINA SPERIMENTALE";"2025";"5";"38970000-5";"RICERCA, SPERIMENTAZIONE E SIMULATORI TECNICO-SCIENTIFICI";"1";;;;"2025-05-12";;;;;;;;"1";"7.0";"non applicabile";"0";;"02044190615";"UNIVERSITA' DEGLI STUDI DELLA CAMPANIA L. VANVITELLI";;;;;;;;;;"1.0";"AGGIUDICATA";"2025-05-12";"1"
"B6D75F00D9";;"41569aa4-02a9-4deb-a6e8-0135c12e775c";"PROGETTAZIONE E REALIZZAZIONE DI INIZIATIVE FORMATIVE IN MATERIA DI INTELLIGENZA ARTIFICIALE (AI)";"18000.0";"1";"PROGETTAZIONE E REALIZZAZIONE DI INIZIATIVE FORMATIVE IN MATERIA DI INTELLIGENZA ARTIFICIALE (AI)";"18000.0";"SERVIZI";"ATTIVO";"SETTORI ORDINARI";"022205";"TRENTO";"2025-05-14";"2025-05-13";"24";"AFFIDAMENTO DIRETTO";"1";"CONTRATTO D'APPALTO";"0000189921";"01533550222";"CONSORZIO DEI COMUNI TRENTINI - SOCIETA' COOPERATIVA";"SEZIONE REGIONALE PROVINCIA AUTONOMA DI TRENTO";"B880A135-33C3-4537-B64F-6AE903F92832";"UNICO";"2025";"5";"80510000";;"1";;;;"2025-05-13";;;;;;;;"1";"7.0";"non applicabile";"0";;"01533550222";"CONSORZIO DEI COMUNI TRENTINI SOCIETA' COOPERATIVA";;;"0.0";;;;;;;"1.0";"AGGIUDICATA";"2025-05-13";"0"
"B6D8829A84";;"CONSIP_RDO_5319295";"R.D.O. MEPA PER L'INDIVIDUAZIONE DEL FORNITORE DEL SERVIZIO BASATO SU UN SISTEMA DI INTELLIGENZA ARTIFICIALE INCLUSIVO DI SENSORISTICA INTEGRATA PER LA RAZIONALIZZAZIONE IDRICA DA SPERIMENTARE SU AREE ADIBITE A COLTIVAZIONI DI LIMONI NELL'AMBITO DEL PROGETTO A REGIA GAL INTITOLATO RIGENERAZIONE INTEGRATA DEL COMPARTO LIMONICOLO- ACRONIMO: LEMON";"71565.18";"1";"SERVIZIO BASATO SU UN SISTEMA DI INTELLIGENZA ARTIFICIALE PER LA RAZIONALIZZAZIONE IDRICA";"71565.18";"SERVIZI";"ATTIVO";"SETTORI ORDINARI";"087004";"CATANIA";"2025-05-15";"2025-05-13";"24";"AFFIDAMENTO DIRETTO";"1";"CONTRATTO D'APPALTO";"0000596540";"05401940878";"GRUPPO DI AZIONE LOCALE TERRE DI ACI SOCIETA' CONSORTILE A RESPONSABILITA' LIMITATA";"SEZIONE REGIONALE SICILIA";"4D1F0830-2E98-470A-B942-A5AE838F15F1";"SOCIETA CONSORTILE GRUPPO DI AZIONE LOCALE (GAL)";"2025";"5";"72000000-5";"SERVIZI INFORMATICI: CONSULENZA, SVILUPPO DI SOFTWARE, INTERNET E SUPPORTO";"1";;;;"2025-05-13";;;;;;;;"1";"7.0";"non applicabile";"0";;"05401940878";"GRUPPO DI AZIONE LOCALE TERRE DI ACI SOCIETA' CONSORTILE A RESPONSABILITA' LIMITATA";;;"2147.21";;;;;;;"1.0";"AGGIUDICATA";"2025-05-13";"0"
"B6DA5C166F";;"APP_20250514_1747213683733812";"BANCA DATI TOP 24 FISCO + INTELLIGENZA ARTIFICIALE";"9050.0";"1";"BANCA DATI TOP 24 FISCO + INTELLIGENZA ARTIFICIALE";"9050.0";"SERVIZI";"ATTIVO";"SETTORI ORDINARI";"066049";"L'AQUILA";"2025-05-15";"2025-05-14";"24";"AFFIDAMENTO DIRETTO";"1";"CONTRATTO D'APPALTO";"0000155335";"00083520668";"GRAN SASSO ACQUA S.P.A.";"SEZIONE REGIONALE ABRUZZO";"4482";"UFFICIO TECNICO";"2025";"5";"72320000-4";"SERVIZI DI BANCHE DATI";"1";;;;"2025-05-14";;;;;;;;"1";"7.0";"non applicabile";"0";;"00083520668";"GRAN SASSO ACQUA S.P.A.";;;;;;;;;;"1.0";"AGGIUDICATA";"2025-05-14";"0"
"B6DCA6D9A7";;"731683_26399";"SERVIZI PROFESSIONALI PER LA VALUTAZIONE ETICA DI UNA SOLUZIONE INFORMATICA BASATA SU INTELLIGENZA ARTIFICIALE GENERATIVA.";"10000.0";"1";"SERVIZI PROFESSIONALI PER LA VALUTAZIONE ETICA DI UNA SOLUZIONE INFORMATICA BASATA SU INTELLIGENZA ARTIFICIALE GENERATIVA.";"10000.0";"SERVIZI";"ATTIVO";"SETTORI ORDINARI";"058091";"ROMA";"2025-05-15";"2025-05-14";"24";"AFFIDAMENTO DIRETTO";"1";"CONTRATTO D'APPALTO";"0000176947";"00997670583";"BANCA D ITALIA";"SEZIONE REGIONALE CENTRALE";"F44B81B1-C030-4131-846A-2F3C17C96417";"BANCA D'ITALIA";"2025";"5";"72220000-3";"SERVIZI DI CONSULENZA IN SISTEMI INFORMATICI E ASSISTENZA TECNICA";"1";;;;"2025-05-14";;;;;;;;"1";"7.0";"non applicabile";"0";;"00997670583";"BANCA D'ITALIA";;;;;;;;;;"1.0";"AGGIUDICATA";"2025-05-14";"0"
"B6DE7CC688";;"4f527ea8-730c-457f-ba15-db2530a2fb38";"AFFIDAMENTO AL CONSORZIO DEI COMUNI TRENTINI DELL'INCARICO DI PROGETTAZIONE, ORGANIZZAZIONE E REALIZZAZIONE INCONTRI FORMATIVI SULL'INTELLIGENZA ARTIFICIALE.";"3760.0";"1";"AFFIDAMENTO AL CONSORZIO DEI COMUNI TRENTINI DELL'INCARICO DI PROGETTAZIONE, ORGANIZZAZIONE E REALIZZAZIONE INCONTRI FORMATIVI SULL'INTELLIGENZA ARTIFICIALE.";"3760.0";"SERVIZI";"ATTIVO";"SETTORI ORDINARI";"022205";"TRENTO";"2025-05-16";;"25";"AFFIDAMENTO DIRETTO A SOCIETA' IN HOUSE";"999";"ND";"0000164583";"00355870221";"COMUNE DI TRENTO";"SEZIONE REGIONALE PROVINCIA AUTONOMA DI TRENTO";"B492FDF0-7DDE-4578-B43D-1AC99DE20666";"SERVIZIO RISORSE UMANE";"2025";"5";"80511000";;"1";;;;"2025-05-15";;;;;;;;"0";;;"0";;"00355870221";"COMUNE DI TRENTO";;;"0.0";;;;;;;"1.0";"AGGIUDICATA";"2025-05-15";"0"
"B6E61C6F08";;"1c5c3ab3-1c52-4c57-9793-3fcd0231b754";"FORNITURA DI UN SISTEMA DI INTELLIGENZA ARTIFICIALE ";"70000.0";"1";"FORNITURA DI UN SISTEMA DI INTELLIGENZA ARTIFICIALE ";"70000.0";"FORNITURE";"ATTIVO";"SETTORI ORDINARI";"022205";"TRENTO";"2025-05-19";"2025-05-16";"24";"AFFIDAMENTO DIRETTO";"1";"CONTRATTO D'APPALTO";"0000160082";"00358520229";"AZIENDA PUBBLICA DI SERVIZI ALLA PERSONA MARGHERITA GRAZIOLI";"SEZIONE REGIONALE PROVINCIA AUTONOMA DI TRENTO";"41DB7F4C-D847-4AB8-9FF9-B0B1E4C0E02F";"UNICO";"2025";"5";"44411000";;"1";;;;"2025-05-16";;;;;;;;"1";"7.0";"non applicabile";"0";;"00358520229";"AZIENDA PUBBLICA DI SERVIZI ALLA PERSONA MARGHERITA GRAZIOLI";;;"0.0";;;;;;;"1.0";"AGGIUDICATA";"2025-05-16";"0"
"B6E710216E";;"CONSIP_RDO_5338719";"RICHIESTA DI SERVIZI INTERNATIONAL MASTER IN PUBLIC PROCUREMENT MANAGEMENT (IMPPM) CORSO DI LAUREA: GLOBAL GOVERNANCE MASTER IN PROCUREMENT MANAGEMENT (EXE) MASTER IN CUSTOMER EXPERIENCE, STATISTICS, MACHINE LEARNING & ARTIFICIAL INTELLIGENCE (CESMA)";"60000.0";"1";"EROGAZIONE DI SERVIZI PER BIGLIETTERIA AERE/TRENO E SOGGIORNO E COMM AGENZIA";"60000.0";"SERVIZI";"ATTIVO";"SETTORI ORDINARI";"058091";"ROMA";"2025-05-19";"2025-05-16";"24";"AFFIDAMENTO DIRETTO";"1";"CONTRATTO D'APPALTO";"0000242408";"80213750583";"UNIVERSITA DEGLI STUDI DI ROMA TOR VERGATA";"SEZIONE REGIONALE CENTRALE";"1B0F202B-D7A3-47BA-B721-548E82D4CF84";"DIPARTIMENTO DEF";"2025";"5";"63515000-2";"SERVIZI RELATIVI ALL'ORGANIZZAZIONE DI VIAGGI";"1";;;;"2025-05-16";;;;;;;;"1";"7.0";"non applicabile";"0";;"80213750583";"UNIVERSITA' DEGLI STUDI DI ROMA TOR VERGATA";;;;;;;;;;"1.0";"AGGIUDICATA";"2025-05-16";"0"
"B6E8ABEE01";;"start_07/05/2025 12:35:17_017051/2025";"ACQUISTO CORSI DI FORMAZIONE IN LINGUA INGLESE, INTELLIGENZA ARTIFICIALE E DIGITAL SKILLS, ANNUALITA' 2025-2026 - PROGETTO SCIRE 2025 2026 FORMAZIONE, INCONTRI E DIBATTITI NELLE BIBLIOTECHE E ARCHIVI ARETINI CODICE 318719 – CUP H13J25000000002";"20369.0";"1";"ACQUISTO CORSI DI FORMAZIONE IN LINGUA INGLESE, INTELLIGENZA ARTIFICIALE E DIGITAL SKILLS, ANNUALITA' 2025-2026 - PROGETTO SCIRE 2025 2026 FORMAZIONE, INCONTRI E DIBATTITI NELLE BIBLIOTECHE E ARCHIVI ARETINI CODICE 318719 – CUP H13J25000000002";"20369.0";"SERVIZI";"ATTIVO";"SETTORI ORDINARI";"051002";"AREZZO";"2025-05-20";"2025-05-19";"24";"AFFIDAMENTO DIRETTO";"1";"CONTRATTO D'APPALTO";"0000330487";"92026790516";"ISTITUZIONE BIBLIOTECA CITTA DI AREZZO";"SEZIONE REGIONALE TOSCANA";"E816A11E-5BB7-4098-91E2-A116B703A9CD";"DIREZIONE";"2025";"5";"80522000-9";"SEMINARI DI FORMAZIONE";"1";;;;"2025-05-19";;;;;;;;"1";"7.0";"non applicabile";"0";;"92026790516";"ISTITUZIONE BIBLIOTECA CITTA' DI AREZZO";;;"0.0";;;;;;;"1.0";"AGGIUDICATA";"2025-05-19";"0"
"B6E9600850";;"CONSIP_RDO_5327492";"ACQUISTO SERVIZIO DI NOLEGGIO BIENNALE TABLET PER PROGETTO SCADUTO.AI: L'INTELLIGENZA ARTIFICIALE A SUPPORTO DEL SUCCESSO EDUCATIVO E DELLA LOTTA ALLA DISPERSIONE SCOLASTICA";"29500.0";"1";"ACQUISTO SERVIZIO DI NOLEGGIO BIENNALE TABLET PER PROGETTO SCADUTO.AI: L'INTELLIGENZA ARTIFICIALE A SUPPORTO DEL SUCCESSO EDUCATIVO E DELLA LOTTA ALLA DISPERSIONE SCOLASTICA";"29500.0";"SERVIZI";"ATTIVO";"SETTORI ORDINARI";"082006";"PALERMO";"2025-05-20";"2025-05-19";"24";"AFFIDAMENTO DIRETTO";"1";"CONTRATTO D'APPALTO";"0000247170";"90007790828";"LICEO GINNASIO DI STATO F. SCADUTO";"SEZIONE REGIONALE SICILIA";"D26831A6-3242-4F1A-BB7E-9351063A4513";"DIRIGENTE";"2025";"5";"72500000-0";"SERVIZI INFORMATICI";"1";;;;"2025-05-19";;;;;;;;"1";"7.0";"non applicabile";"0";;"90007790828";"LICEO GINNASIO DI STATO F. SCADUTO";;;;;;;;;;"1.0";"AGGIUDICATA";"2025-05-19";"0"
"B6EA49A503";;"CONSIP_RDO_5253352";"GARA 5450 - FORNITURA IN NOLEGGIO TRIENNALE DEL SISTEMA FIBROSCAN 630 EXPERT COMPRENSIVO DI SONDE E ACCESSORI, INERENTE AL PROGETTO PNRR RICERCA CODICE PNRR-MCNT-2023-12378247, DAL TITOLO OPTIMIZING NONINVASIVE ASSESSMENT OF DYSMETABOLIC COMPENSATED ADVANCED LIVER DISEASE BY INTEGRATION OF ARTIFICIAL INTELLIGENCE MODEL AND OMICS DATA MODELS RESPONSABILE SCIENTIFICO DELLA RICERCA PROF.SSA FILOMENA MORISCO, FINANZIATO DALL'UNIONE EUROPEA NEXT GENERATION EU PNRR M6C2 INNOVAZIONE, RICERCA E DIGITALIZZAZIONE DEL SERVIZIO SANITARIO I2.1 RAFFORZAMENTO E POTENZIAMENTO DELLA RICERCA BIOMEDICA DEL SSN";"60000.0";"1";"FORNITURA IN NOLEGGIO TRIENNALE DEL SISTEMA FIBROSCAN 630 EXPERT COMPRENSIVO DI SONDE E ACCESSORI, INERENTE AL PROGETTO PNRR RICERCA CODICE PNRR-MCNT-2023-12378247, DAL TITOLO OPTIMIZING NONINVASIVE ASSESSMENT OF DYSMETABOLIC COMPENSATED ADVANCED LIVER DISEASE BY INTEGRATION OF ARTIFICIAL INTELLIGENCE MODEL AND OMICS DATA (MODELS) RESPONSABILE SCIENTIFICO DELLA RICERCA PROF.SSA FILOMENA MORISCO, FINANZIATO DALL'UNIONE EUROPEA – NEXT GENERATION EU – PNRR M6C2";"60000.0";"FORNITURE";"ATTIVO";"SETTORI ORDINARI";"063049";"NAPOLI";"2025-05-20";"2025-05-19";"24";"AFFIDAMENTO DIRETTO";"1";"CONTRATTO D'APPALTO";"0000227327";"06909360635";"AZIENDA OSPEDALIERA UNIVERSITARIA FEDERICO II";"SEZIONE REGIONALE CAMPANIA";"D1FE043A-E43B-44F3-A7A5-0CFC83802D41";"UOC GESTIONE ACQUISIZIONE BENI E SERVIZI - ECONOMATO";"2025";"5";"33124120-2";"APPARECCHI A ULTRASUONI PER USO DIAGNOSTICO";"1";;;;"2025-05-19";;;;;;;;"1";"7.0";"non applicabile";"0";;"06909360635";"AZIENDA OSPEDALIERA UNIVERSITARIA FEDERICO II";;;;;;;;;;"1.0";"AGGIUDICATA";"2025-05-19";"0"
"B6F26828BA";"B200FA7CE5";"CONSIP_ORDINE_8497781";"FORNITURA STAMPANTE MULTIFUNZIONE PNRR-TR1-2023-12378148";"1748.25";"1";"FORNITURA TRAMITE ADESIONE ALLA CONVENZIONE CONSIP DENOMINATA: STAMPANTI 21 - LOTTO 5 DI N. 1 STAMPANTE MULTIFUNZIONE A4 E 3 KIT CARTUCCE INCHIOSTRO, PER IL PROGETTO PNRR-TR1-2023-12378146 SIMPLIF-AI: SIMPLIFICATION AND STANDARDIZATION OF CARE PATHWAYS FOR PATIENTS WITH RARE BRAIN TUMORS THROUGH ARTIFICIAL INTELLIGENCE - CUP: E13C24000820001";"1748.25";"FORNITURE";"ATTIVO";"SETTORI ORDINARI";"066049";"L'AQUILA";"2025-05-20";"2025-05-20";"24";"AFFIDAMENTO DIRETTO";"11";"CONTRATTO D'APPALTO DISCENDENTE DA ACCORDO QUADRO/CONVENZIONE SENZA SUCCESSIVO CONFRONTO COMPETITIVO";"0000275136";"01792410662";"AZIENDA SANITARIA LOCALE 1 DI AVEZZANO-SULMONA-L AQUILA";"SEZIONE REGIONALE ABRUZZO";"695C0B2C-4D38-46D7-BACF-4D02F7551052";"U.O.C.ACQUISIZIONE E GESTIONE BENI E SERVIZI";"2025";"5";"30232150-0";"STAMPANTI A GETTO D'INCHIOSTRO";"1";;;;"2025-05-20";;;;;;;;"0";;;"0";;"01792410662";"ASL1 AVEZZANO-SULMONA-L'AQUILA";;;;;;;;;;"1.0";"AGGIUDICATA";"2025-05-20";"0"
"B6F6172BBC";;"CONSIP_RDO_5341285";"AFFIDAMENTO DIRETTO AI SENSI DELL'ART. 50 COMMA 1 LETT. B) DEL D. LGS 36/2023 DEL SERVIZIO DI SVILUPPO DI UN PERCORSO DI FORMAZIONE IMMERSIVA BASATA SU INTELLIGENZA ARTIFICIALE (IA)";"105000.0";"1";"SERVIZIO DI SVILUPPO DI UN PERCORSO DI FORMAZIONE IMMERSIVA BASATA SU INTELLIGENZA ARTIFICIALE (IA)";"105000.0";"SERVIZI";"ATTIVO";"SETTORI ORDINARI";"015146";"MILANO";"2025-05-22";"2025-05-21";"24";"AFFIDAMENTO DIRETTO";"1";"CONTRATTO D'APPALTO";"0000247487";"97346000157";"FONDAZIONE POLITECNICO DI MILANO";"SEZIONE REGIONALE LOMBARDIA";"25B49C43-A86F-4B64-AEBC-0A9642C76550";"FONDAZIONE POLITECNICO DI MILANO";"2025";"5";"72212931-4";"SERVIZI DI PROGRAMMAZIONE DI SOFTWARE DI FORMAZIONE";"1";;;;"2025-05-21";;;;;;;;"1";"7.0";"non applicabile";"0";;"97346000157";"FONDAZIONE POLITECNICO DI MILANO";;;;;;;;;;"1.0";"AGGIUDICATA";"2025-05-21";"0"
"B6F7780EF5";;"tender://milomb_camcom/id/1422";"RICHIESTA DI PREVENTIVO FINALIZZATA ALL'AFFIDAMENTO DIRETTO PER UN CORSO DI 12 ORE SULL'INTELLIGENZA ARTIFICIALE GENERATIVA PER L'INTERNAZIONALIZZAZIONE DELLE PMI";"7000.0";"1";"RICHIESTA DI PREVENTIVO FINALIZZATA ALL'AFFIDAMENTO DIRETTO PER UN CORSO DI 12 ORE SULL'INTELLIGENZA ARTIFICIALE GENERATIVA PER L'INTERNAZIONALIZZAZIONE DELLE PMI";"7000.0";"SERVIZI";"ATTIVO";"SETTORI ORDINARI";"015146";"MILANO";"2025-05-22";"2025-05-21";"24";"AFFIDAMENTO DIRETTO";"1";"CONTRATTO D'APPALTO";"0000591940";"10322390963";"AGENZIA ITALIANA PER L INTERNAZIONALIZZAZIONE - PROMOS ITALIA S.C.R.L.";"NON CLASSIFICATO";"2BD114E3-2EED-47AB-B983-04189F95FCB0";"UFFICIO ACQUISTI";"2025";"5";"80500000-9";"SERVIZI DI FORMAZIONE";"1";;;;"2025-05-21";;;;;;;;"1";"7.0";"non applicabile";"0";;"10322390963";"PROMOS ITALIA S.C.R.L.";;;;;;;;;;"1.0";"AGGIUDICATA";"2025-05-21";"0"
"B6FC6778E9";;"8b2a6c0a-9979-4959-bda9-521848b0f113";"AFFIDAMENTO DIRETTO DI SERVIZI DI CONSULENZA SPECIALISTICA E TECNOLOGICA: ANOMALY DETECTION IN AMBITO MODA E DESIGN BASATO SU UN SISTEMA DI INTELLIGENZA ARTIFICIALE PER LA RILEVAZIONE DI DIFETTI E ANOMALIE VISUALI NELL'AMBITO DEL PROGETTO ER2DIGIT";"74709.6";"1";"AFFIDAMENTO DIRETTO DI SERVIZI DI CONSULENZA SPECIALISTICA E TECNOLOGICA: ANOMALY DETECTION IN AMBITO MODA E DESIGN BASATO SU UN SISTEMA DI INTELLIGENZA ARTIFICIALE PER LA RILEVAZIONE DI DIFETTI E ANOMALIE VISUALI NELL'AMBITO DEL PROGETTO ER2DIGIT";"74709.6";"SERVIZI";"ATTIVO";"SETTORI ORDINARI";"037006";"BOLOGNA";"2025-05-23";"2025-05-22";"24";"AFFIDAMENTO DIRETTO";"1";"CONTRATTO D'APPALTO";"0000605335";"03786281208";"ART-ER SOCIETA CONSORTILE PER AZIONI";"SEZIONE REGIONALE EMILIA ROMAGNA";"3D257DD0-650A-413E-B764-4A4A9B0FE026";"DIREZIONE E AMMINISTRAZIONE";"2025";"5";"72510000";;"1";;;;"2025-05-22";;;;;;;;"1";"7.0";"non applicabile";"0";;"03786281208";"ART-ER - SOCIETA' CONSORTILE PER AZIONI";;;"0.0";;;;;;;"1.0";"AGGIUDICATA";"2025-05-22";"1"
"B701701F6A";;"bolzano_04/04/2025 13:54:31_030934/2025";"AFFIDAMENTO DEL SERVIZIO DI SUPPORTO SVILUPPO SOFTWARE BASATO SU SISTEMI DI INTELLIGENZA ARTIFICIALE IDO15849";"122950.83";"1";"AFFIDAMENTO DEL SERVIZIO DI SUPPORTO SVILUPPO SOFTWARE BASATO SU SISTEMI DI INTELLIGENZA ARTIFICIALE IDO15849";"122950.83";"SERVIZI";"ATTIVO";"SETTORI ORDINARI";"021008";"BOLZANO";"2025-05-26";"2025-05-23";"24";"AFFIDAMENTO DIRETTO";"1";"CONTRATTO D'APPALTO";"0000245175";"94060760215";"LIBERA UNIVERSITA DI BOLZANO";"SEZIONE REGIONALE PROVINCIA AUTONOMA DI BOLZANO";"F290997F-4628-4C0C-BE8A-30838358827E";"UFFICIO ACQUISTI";"2025";"5";"72262000-9";"SERVIZI DI SVILUPPO DI SOFTWARE";"1";;;;"2025-05-23";;;;;;;;"1";"7.0";"non applicabile";"0";;"94060760215";"LIBERA UNIVERSITA' DI BOLZANO";;;"0.0";;;;;;;"1.0";"AGGIUDICATA";"2025-05-23";"0"
"B701A6D254";;"245-1486";"CANONE ASS. SW ANNUA INTELLIGENZA ARTIFICIALE ALGHO 2025 - READY DIGITAL";"13388.96";"1";"CANONE ASS. SW ANNUA INTELLIGENZA ARTIFICIALE ALGHO 2025 - READY DIGITAL";"13388.96";"SERVIZI";"ATTIVO";"SETTORI ORDINARI";"055032";"TERNI";"2025-05-27";"2025-05-23";"24";"AFFIDAMENTO DIRETTO";"1";"CONTRATTO D'APPALTO";"0000167528";"00693630550";"ASM TERNI S.P.A.";"SEZIONE REGIONALE UMBRIA";"456BCEA9-517A-42FE-9882-EA66E3D83245";"INNOVAZIONE";"2025";"5";"72000000-5";"SERVIZI INFORMATICI: CONSULENZA, SVILUPPO DI SOFTWARE, INTERNET E SUPPORTO";"1";;;;"2025-05-23";;;;;;;;"1";"7.0";"non applicabile";"0";;"00693630550";"ASM TERNI S.P.A.";;;;;;;;;;"1.0";"AGGIUDICATA";"2025-05-23";"0"
"B704268085";;"CONSIP_RDO_5381711";"ACQUISTO STAND PER WMF - WE MAKE FUTURE, LA FIERA INTERNAZIONALE SULL'INTELLIGENZA ARTIFICIALE, LA TECNOLOGIA E L'INNOVAZIONE DIGITALE, IN PROGRAMMA DAL 4 AL 6 GIUGNO PRESSO IL POLO FIERISTICO DI BOLOGNA";"33000.0";"1";"ACQUISTO STAND PER WMF - WE MAKE FUTURE, LA FIERA INTERNAZIONALE SULL'INTELLIGENZA ARTIFICIALE, LA TECNOLOGIA E L'INNOVAZIONE DIGITALE, IN PROGRAMMA DAL 4 AL 6 GIUGNO PRESSO IL POLO FIERISTICO DI BOLOGNA";"33000.0";"SERVIZI";"ATTIVO";"SETTORI ORDINARI";"058091";"ROMA";"2025-05-27";"2025-05-26";"24";"AFFIDAMENTO DIRETTO";"1";"CONTRATTO D'APPALTO";"0000539907";"97803850581";"MINISTERO DEI BENI E DELLE ATTIVITA' CULTURALI E DEL TURISMO - SEGRETARIATO GENERALE";"SEZIONE REGIONALE CENTRALE";"CF8C97CD-3F07-46C7-90C3-0D580D582DE1";"MIBACT SEGRETARIATO GENERALE";"2025";"5";"79956000-0";"SERVIZI DI ORGANIZZAZIONE DI FIERE ED ESPOSIZIONI";"1";;;;"2025-05-26";;;;;;;;"1";"7.0";"non applicabile";"0";;"97803850581";"MINISTERO DEI BENI E DELLE ATTIVITA' CULTURALI E DEL TURISMO - SEGRETARIATO GENERALE";;;;;;;;;;"1.0";"AGGIUDICATA";"2025-05-26";"0"
"B704ED0D6C";;"576627_T25_10666";"SERVIZIO DI IMPLEMENTAZIONE DI MODELLI MANUTENZ PREDITTIVA WTE HERAMBIENTE S.P.A";"118800.0";"1";"SERVIZIO DI IMPLEMENTAZIONE DI MODELLI DI MANUTENZIONE PREDITTIVA BASATI SU INTELLIGENZA ARTIFICIALE PRESSO I TERMOVALORIZZATORI DI HERAMBIENTE S.P.A.";"118800.0";"SERVIZI";"ATTIVO";"SETTORI ORDINARI";"037006";"BOLOGNA";"2025-05-30";"2025-05-26";"24";"AFFIDAMENTO DIRETTO";"1";"CONTRATTO D'APPALTO";"0000197390";"02175430392";"HERAMBIENTE S.P.A.";"SEZIONE REGIONALE EMILIA ROMAGNA";"8A7FBAED-356E-4933-8B57-1BDB37E4E141";"HERAMBIENTE SPA";"2025";"5";"72300000-8";"SERVIZI DI ELABORAZIONE DATI";"1";;;;"2025-05-26";;;;;;;;"1";"7.0";"non applicabile";"0";;"02175430392";"HERAMBIENTE S.P.A.";;;"0.0";;;;;;;"1.0";"AGGIUDICATA";"2025-05-26";"0"
