B5D2F06B64;;CONSIP_RDO_5115213;SOLUZIONE SOFTWARE AVANZATA DI VIDEO EDITING CON INTELLIGENZA ARTIFICIALE GENERATIVA;67500.0;1;SOLUZIONE SOFTWARE AVANZATA DI VIDEO EDITING CON INTELLIGENZA ARTIFICIALE GENERATIVA;67500.0;SERVIZI;ATTIVO;SETTORI ORDINARI;15146.0;MILANO;2025-02-27;2025-02-26;24;AFFIDAMENTO DIRETTO;1;CONTRATTO D'APPALTO;244270;80057930150;POLITECNICO DI MILANO;SEZIONE REGIONALE CENTRALE;4CE7FE1D-CB65-4AD7-86DE-EAC0650A18B5;CENTRO METID;2025;2;72212300-2;SERVIZI DI PROGRAMMAZIONE DI SOFTWARE PER CREAZIONI DI DOCUMENTI, DISEGNI, IMMAGINI, PROGRAMMAZIONE E PRODUTTIVITÀ;1;;;;2025-02-26;;;;;;;;1;7.0;non applicabile;0.0;;80057930150.0;POLITECNICO DI MILANO;;;;;;;;;;1.0;AGGIUDICATA;2025-02-26;1;2025;Altre applicazioni IA;Università e Ricerca;True;67500.0;False
B5990BD65B;;CONSIP_RDO_5070443;C0039S25 - SERVIZIO DI FORMAZIONE STRUTTURATA PER I CORSI SUL TEMA DELL'INTELLIGENZA ARTIFICIALE;5000.0;1;C0039S25 - SERVIZIO DI FORMAZIONE STRUTTURATA PER I CORSI SUL TEMA DELL'INTELLIGENZA ARTIFICIALE;5000.0;SERVIZI;ATTIVO;SETTORI ORDINARI;58091.0;ROMA;2025-02-12;2025-02-11;24;AFFIDAMENTO DIRETTO;1;CONTRATTO D'APPALTO;224109;5779721009;SO.G.I.N. - SOCIETA GESTIONE IMPIANTI NUCLEARI PER AZIONI;SEZIONE REGIONALE CENTRALE;D44812F0-061D-4C54-8F69-FA65A6755F36;SOGIN SPA - SEDE CENTRALE;2025;2;80510000-2;SERVIZI DI FORMAZIONE SPECIALISTICA;1;;;;2025-02-11;;;;;;;;1;7.0;non applicabile;0.0;;5779721009.0;SO.G.I.N.-SOCIETA' GESTIONE IMPIANTI NUCLEARI SPA;;;;;;;;;;1.0;AGGIUDICATA;2025-02-11;0;2025;Formazione IA;Altri Enti Pubblici;False;5000.0;False
B5C6F2644B;;tender://tecnoborsa/id/54;RICHIESTA PREVENTIVO AI SENSI DELL'ART. 50 COMMA 1, LETTERA B) DEL D.LGS. 36/2023, COME AGGIORNATO DAL D. LGS. 209/2024, PER L'AFFIDAMENTO DELLA PROGETTAZIONE E GESTIONE CHIAVI IN MANO DI UN PROGRAMMA TECNICO FORMATIVO DAL TITOLO INTELLIGENZA ARTIFICIALE: APPROCCI E STRUMENTI INNOVATIVI PER AGENZIE IMMOBILIARI;36000.0;1;RICHIESTA PREVENTIVO AI SENSI DELL'ART. 50 COMMA 1, LETTERA B) DEL D.LGS. 36/2023, COME AGGIORNATO DAL D. LGS. 209/2024, PER L'AFFIDAMENTO DELLA PROGETTAZIONE E GESTIONE CHIAVI IN MANO DI UN PROGRAMMA TECNICO FORMATIVO DAL TITOLO INTELLIGENZA ARTIFICIALE: APPROCCI E STRUMENTI INNOVATIVI PER AGENZIE IMMOBILIARI;36000.0;SERVIZI;ATTIVO;SETTORI ORDINARI;58091.0;ROMA;2025-02-25;2025-02-24;24;AFFIDAMENTO DIRETTO;1;CONTRATTO D'APPALTO;306381;5375771002;TECNOBORSA CONSORZIO NAZIONALE SVILUPPO MERCATO IMMOBILIARE S.C.P.A.;SEZIONE REGIONALE LAZIO;0D00875F-8C2E-4DA4-AF97-57BF0E10AF03;AFFIDAMENTI;2025;2;79960000-1;SERVIZI FOTOGRAFICI E SERVIZI AUSILIARI;0;;;;2025-02-24;;;;;;;;1;7.0;non applicabile;0.0;;5375771002.0;TECNOBORSA CONSORZIO NAZIONALE SVILUPPO MERCATO IMMOBILIARE S.C.P.A.;;;;;;;;;;1.0;AGGIUDICATA;2025-02-24;0;2025;Altre applicazioni IA;Altri Enti Pubblici;False;36000.0;False
B5C6F2644B;;tender://tecnoborsa/id/54;RICHIESTA PREVENTIVO AI SENSI DELL'ART. 50 COMMA 1, LETTERA B) DEL D.LGS. 36/2023, COME AGGIORNATO DAL D. LGS. 209/2024, PER L'AFFIDAMENTO DELLA PROGETTAZIONE E GESTIONE CHIAVI IN MANO DI UN PROGRAMMA TECNICO FORMATIVO DAL TITOLO INTELLIGENZA ARTIFICIALE: APPROCCI E STRUMENTI INNOVATIVI PER AGENZIE IMMOBILIARI;36000.0;1;RICHIESTA PREVENTIVO AI SENSI DELL'ART. 50 COMMA 1, LETTERA B) DEL D.LGS. 36/2023, COME AGGIORNATO DAL D. LGS. 209/2024, PER L'AFFIDAMENTO DELLA PROGETTAZIONE E GESTIONE CHIAVI IN MANO DI UN PROGRAMMA TECNICO FORMATIVO DAL TITOLO INTELLIGENZA ARTIFICIALE: APPROCCI E STRUMENTI INNOVATIVI PER AGENZIE IMMOBILIARI;36000.0;SERVIZI;ATTIVO;SETTORI ORDINARI;58091.0;ROMA;2025-02-25;2025-02-24;24;AFFIDAMENTO DIRETTO;1;CONTRATTO D'APPALTO;306381;5375771002;TECNOBORSA CONSORZIO NAZIONALE SVILUPPO MERCATO IMMOBILIARE S.C.P.A.;SEZIONE REGIONALE LAZIO;0D00875F-8C2E-4DA4-AF97-57BF0E10AF03;AFFIDAMENTI;2025;2;92111000-2;SERVIZI DI PRODUZIONE DI FILM E VIDEO;0;;;;2025-02-24;;;;;;;;1;7.0;non applicabile;0.0;;5375771002.0;TECNOBORSA CONSORZIO NAZIONALE SVILUPPO MERCATO IMMOBILIARE S.C.P.A.;;;;;;;;;;1.0;AGGIUDICATA;2025-02-24;0;2025;Altre applicazioni IA;Altri Enti Pubblici;False;36000.0;False
B5C6F2644B;;tender://tecnoborsa/id/54;RICHIESTA PREVENTIVO AI SENSI DELL'ART. 50 COMMA 1, LETTERA B) DEL D.LGS. 36/2023, COME AGGIORNATO DAL D. LGS. 209/2024, PER L'AFFIDAMENTO DELLA PROGETTAZIONE E GESTIONE CHIAVI IN MANO DI UN PROGRAMMA TECNICO FORMATIVO DAL TITOLO INTELLIGENZA ARTIFICIALE: APPROCCI E STRUMENTI INNOVATIVI PER AGENZIE IMMOBILIARI;36000.0;1;RICHIESTA PREVENTIVO AI SENSI DELL'ART. 50 COMMA 1, LETTERA B) DEL D.LGS. 36/2023, COME AGGIORNATO DAL D. LGS. 209/2024, PER L'AFFIDAMENTO DELLA PROGETTAZIONE E GESTIONE CHIAVI IN MANO DI UN PROGRAMMA TECNICO FORMATIVO DAL TITOLO INTELLIGENZA ARTIFICIALE: APPROCCI E STRUMENTI INNOVATIVI PER AGENZIE IMMOBILIARI;36000.0;SERVIZI;ATTIVO;SETTORI ORDINARI;58091.0;ROMA;2025-02-25;2025-02-24;24;AFFIDAMENTO DIRETTO;1;CONTRATTO D'APPALTO;306381;5375771002;TECNOBORSA CONSORZIO NAZIONALE SVILUPPO MERCATO IMMOBILIARE S.C.P.A.;SEZIONE REGIONALE LAZIO;0D00875F-8C2E-4DA4-AF97-57BF0E10AF03;AFFIDAMENTI;2025;2;80000000-4;SERVIZI DI ISTRUZIONE E FORMAZIONE;1;;;;2025-02-24;;;;;;;;1;7.0;non applicabile;0.0;;5375771002.0;TECNOBORSA CONSORZIO NAZIONALE SVILUPPO MERCATO IMMOBILIARE S.C.P.A.;;;;;;;;;;1.0;AGGIUDICATA;2025-02-24;0;2025;Altre applicazioni IA;Altri Enti Pubblici;False;36000.0;False
B5C27A742E;;CONSIP_RDO_5094868;SERVIZI E FORMAZIONE SU INTELLIGENZA ARTIFICIALE;69000.0;1;SERVIZI DI FORMAZIONE;69000.0;SERVIZI;ATTIVO;SETTORI ORDINARI;81011.0;TRAPANI;2025-02-25;2025-02-22;24;AFFIDAMENTO DIRETTO;1;CONTRATTO D'APPALTO;326145;82005650815;ISTITUTO TECNICO COMMERCIALE GIUSEPPE GARIBALDI;SEZIONE REGIONALE CENTRALE;83FCE8D9-149A-4531-9F51-F06A61650C47;ISTITUTO TECNICO COMMERCIALE GIUSEPPE GARIBALDI;2025;2;80510000-2;SERVIZI DI FORMAZIONE SPECIALISTICA;1;;;;2025-02-22;;;;;;;;1;7.0;non applicabile;0.0;;82005650815.0;I.T.E.T. - G. GARIBALDI;;;;;;;;;;1.0;AGGIUDICATA;2025-02-22;0;2025;Formazione IA;Istruzione;False;69000.0;False
B5A30F4CFF;;CONSIP_RDO_5076227;PROGETTAZIONE, REALIZZAZIONE E ASSISTENZA TECNICA ALLA SPERIMENTAZIONE DI UN'APPLICAZIONE DIGITALE CHE UTILIZZA L'INTELLIGENZA ARTIFICIALE PER LA PERSONALIZZAZIONE DELLA DIDATTICA E DELL'APPRENDIMENTO A SUPPORTO DI INSEGNANTI E STUDENTI NAI DA FORNIRE NELL'AMBITO DEL PROGETTO NUOVE ENERGIE IN PERIFERIA - CODICE CUP B39J21039470001;45000.0;1;PROGETTAZIONE, REALIZZAZIONE E ASSISTENZA TECNICA ALLA SPERIMENTAZIONE DI UN'APPLICAZIONE DIGITALE CHE UTILIZZA L'INTELLIGENZA ARTIFICIALE PER LA PERSONALIZZAZIONE DELLA DIDATTICA E DELL'APPRENDIMENTO A SUPPORTO DI INSEGNANTI E STUDENTI NAI DA FORNIRE NELL'AMBITO DEL PROGETTO NUOVE ENERGIE IN PERIFERIA - CODICE CUP B39J21039470001;45000.0;SERVIZI;ATTIVO;SETTORI ORDINARI;10025.0;GENOVA;2025-02-14;2025-02-13;24;AFFIDAMENTO DIRETTO;1;CONTRATTO D'APPALTO;266185;1266130994;JOB CENTRE SOCIETA A RESPONSABILITA LIMITATA CON UNICO SOCIO;SEZIONE REGIONALE LIGURIA;19A93C77-0E52-42AB-AD4C-9F9EF00A1EE0;JOB CENTRE AMM;2025;2;48771000-3;PACCHETI SOFTWARE GENERALI;1;;;;2025-02-13;;;;;;;;1;7.0;non applicabile;0.0;;1266130994.0;JOB CENTRE SOCIETA' A RESPONSABILITA' LIMITATA CON UNICO SOCIO;;;;;;;;;;1.0;AGGIUDICATA;2025-02-13;0;2025;Formazione IA;Altri Enti Pubblici;False;45000.0;False
B5793A8AC2;;b534c536-814d-4d60-aa74-ec2b209725e8@115-G-631;PROGETTAZIONE E REALIZZAZIONE DI UN SISTEMA AVANZATO DI MONITORAGGIO AMBIENTALE;1900000.0;1;"PROGETTAZIONE E REALIZZAZIONE DI UN SISTEMA AVANZATO DI MONITORAGGIO AMBIENTALE PER L&#8217;IDENTIFICAZIONE ED IL CONTROLLO DI SVERSAMENTI ED INTERRAMENTI ILLECITI DI RIFIUTI ORDINARI O PERICOLOSI MEDIANTE L&#8217;USO DI TECNICHE DI REMOTE SENSING (RS) E INTELLIGENZA ARTIFICIALE";1900000.0;SERVIZI;ATTIVO;SETTORI ORDINARI;63050.0;NAPOLI;2025-02-05;2025-03-10;1;PROCEDURA APERTA;1;CONTRATTO D'APPALTO;220794;4525451219;AGENZIA LOCALE DI SVILUPPO AREA NOLA S.C.P.A.;SEZIONE REGIONALE CAMPANIA;0C4FA06D-93AF-4F1D-8406-ED5B6EA78A15;CENTRALE UNICA DI COMMITTENZA DELL'AREA NOLANA - UFFICIO CENTRALE;2025;2;71313000-5;SERVIZI DI CONSULENZA IN INGEGNERIA AMBIENTALE;1;;;;2025-02-03;;;;;24.0;;;1;7.0;NON APPLICABILE;0.0;;;;;;0.0;LA PARTECIPAZIONE NON È RISERVATA.;;;10.0;NO, NESSUNA IPOTESI DI COLLEGAMENTO;;;;;0;2025;Altre applicazioni IA;Altri Enti Pubblici;False;1900000.0;False
B572458F1C;;company_324_procurement_46;01/T/25_ RICHIESTA DI PREVENTIVO PER L'ASSISTENZA ALLA PROGETTAZIONE IN RISPOSTA AL BANDO INTERREG. ALCOTRA E PREPARAZIONE DOSSIER DI PROGETTO - ALLIANCE-ECO - L'INTELLIGENZA ARTIFICIALE ALLEATA DELLA DIFFERENZIATA;7000.0;1;01/T/25_ RICHIESTA DI PREVENTIVO PER L'ASSISTENZA ALLA PROGETTAZIONE IN RISPOSTA AL BANDO INTERREG. ALCOTRA E PREPARAZIONE DOSSIER DI PROGETTO - ALLIANCE-ECO - L'INTELLIGENZA ARTIFICIALE ALLEATA DELLA DIFFERENZIATA;7000.0;SERVIZI;ATTIVO;SETTORI ORDINARI;4130.0;CUNEO;2025-02-04;2025-01-31;24;AFFIDAMENTO DIRETTO;1;CONTRATTO D'APPALTO;196041;1958350041;AZ. CONSORTILE ECOLOGICA MONREGALESE;SEZIONE REGIONALE PIEMONTE;E394B1B6-F5A9-4692-B91C-25DE86D31633;UFFICIO TECNICO;2025;2;85312320-8;SERVIZI DI CONSULENZA;1;;;;2025-01-31;;;;;;;;1;7.0;non applicabile;0.0;;1958350041.0;AZIENDA CONSORTILE ECOLOGICA DEL MONREGALESE;;;;;;;;;;1.0;AGGIUDICATA;2025-01-31;0;2025;Altre applicazioni IA;Altri Enti Pubblici;False;7000.0;False
B5D22D8E55;;start_11/02/2025 11:16:31_004740/2025;RDA 133022 - RINNOVO DEL CANONE TRIENNALE (36 MESI) SMART PLAN E AUTOSEGMANTAZIONE CON INTELLIGENZA ARTIFICIALE;5508.0;1;RDA 133022 - RINNOVO DEL CANONE TRIENNALE (36 MESI) SMART PLAN E AUTOSEGMANTAZIONE CON INTELLIGENZA ARTIFICIALE;5508.0;FORNITURE;ATTIVO;SETTORI ORDINARI;48017.0;FIRENZE;2025-02-27;2025-02-26;24;AFFIDAMENTO DIRETTO;1;CONTRATTO D'APPALTO;221309;4612750481;AZIENDA OSPEDALIERO UNIVERSITARIA-CAREGGI;SEZIONE REGIONALE TOSCANA;C698DA07-630E-4527-88DE-F1745BF113F1;UOC PATRIMONIO E GARE;2025;2;48600000-4;PACCHETTI SOFTWARE OPERATIVI E BASE DATI;0;;;;2025-02-26;;;;;;;;1;7.0;non applicabile;0.0;;4612750481.0;AZIENDA OSPEDALIERO UNIVERSITARIA CAREGGI;;;0.0;;;;;;;1.0;AGGIUDICATA;2025-02-26;0;2025;Altre applicazioni IA;Sanità;False;5508.0;False
B5D22D8E55;;start_11/02/2025 11:16:31_004740/2025;RDA 133022 - RINNOVO DEL CANONE TRIENNALE (36 MESI) SMART PLAN E AUTOSEGMANTAZIONE CON INTELLIGENZA ARTIFICIALE;5508.0;1;RDA 133022 - RINNOVO DEL CANONE TRIENNALE (36 MESI) SMART PLAN E AUTOSEGMANTAZIONE CON INTELLIGENZA ARTIFICIALE;5508.0;FORNITURE;ATTIVO;SETTORI ORDINARI;48017.0;FIRENZE;2025-02-27;2025-02-26;24;AFFIDAMENTO DIRETTO;1;CONTRATTO D'APPALTO;221309;4612750481;AZIENDA OSPEDALIERO UNIVERSITARIA-CAREGGI;SEZIONE REGIONALE TOSCANA;C698DA07-630E-4527-88DE-F1745BF113F1;UOC PATRIMONIO E GARE;2025;2;48900000-7;PACCHETTI SOFTWARE E SISTEMI INFORMATICI VARI;1;;;;2025-02-26;;;;;;;;1;7.0;non applicabile;0.0;;4612750481.0;AZIENDA OSPEDALIERO UNIVERSITARIA CAREGGI;;;0.0;;;;;;;1.0;AGGIUDICATA;2025-02-26;0;2025;Altre applicazioni IA;Sanità;False;5508.0;False
B5D3ECCFA6;;CONSIP_RDO_5106419;ATTIVITÀ DI CONSULENZA FINALIZZATA AL POTENZIAMENTO DI SOLUZIONI RIABILITATIVE PERSONALIZZATE ATTRAVERSO INTELLIGENZA ARTIFICIALE (AI) E MACHINE LEARNING;139000.0;1;ATTIVITÀ DI CONSULENZA FINALIZZATA AL POTENZIAMENTO DI SOLUZIONI RIABILITATIVE PERSONALIZZATE ATTRAVERSO INTELLIGENZA ARTIFICIALE (AI) E MACHINE LEARNING;139000.0;SERVIZI;ATTIVO;SETTORI ORDINARI;63049.0;NAPOLI;2025-02-28;2025-02-27;24;AFFIDAMENTO DIRETTO;1;CONTRATTO D'APPALTO;170308;876220633;UNIVERSITA' DEGLI STUDI DI NAPOLI FEDERICO II;SEZIONE REGIONALE CENTRALE;26D1BD2F-E1D3-496C-9C64-30EBE1C06BD3;CENTRO INTERDIPARTIMENTALE DI RICERCA IN CHIRURGIA ROBOTICA - INTERDEPARTMENTAL CENTER FOR ADVANCES IN ROBOTIC SURGERY - ICAROS;2025;2;79311000-7;SERVIZI DI INDAGINE;1;;;;2025-02-27;;;;;;;;1;7.0;non applicabile;0.0;;876220633.0;UNIVERSITA' DEGLI STUDI DI NAPOLI FEDERICO II;;;;;;;;;;1.0;AGGIUDICATA;2025-02-27;1;2025;Machine Learning & Analytics;Università e Ricerca;True;139000.0;False
B5A6DA2013;;4073a1c3-aeb4-485e-9ed8-dcfaa2fe49f4@1024-G-644;FORNITURA DI UNA PIATTAFORMA ECOGRAFICA;345133.18;1;"GARA EUROPEA A PROCEDURA TELEMATICA APERTA PER LA FORNITURA DI UNA PIATTAFORMA ECOGRAFICA PER IL PROGETTO &#8220;IAUSO - INTELLIGENZA ARTIFICIALE APPLICATA AGLI ULTRASUONI IN OSTETRICIA&#8221; - SPOKE 2 &#8211; &#8220;SMART DEVICES AND TECHNOLOGIES FOR PERSONAL AND REMOTE HEALTHCARE&#8221; NELL&#8217;AMBITO DEL PIANO NAZIONALE DI RIPRESA E RESILIENZA, MISSIONE 4 &#8220;ISTRUZIONE E RICERCA&#8221; &#8211; COMPONENTE 2 &#8220;DALLA RICERCA ALL&#8217;IMPRESA&#8221; &#8211; INVESTIMENTO 1.5 &#8220;CREAZIONE E RAFFORZAMENTO DI &#8220;ECOSISTEMI DELL&#8217;INNOVAZIONE&#8221;, COSTRUZIONE DI &#8220;LEADER TERRITORIALI DI R&AMP;S&#8221;, FINANZIATO DALL&#8217;UNIONE EUROPEA &#8211; NEXTGENERATIONEU.";345133.18;FORNITURE;ATTIVO;SETTORI ORDINARI;72006.0;BARI;2025-02-17;2025-03-21;1;PROCEDURA APERTA;1;CONTRATTO D'APPALTO;246875;80002170720;UNIVERSITA DEGLI STUDI DI BARI ALDO MORO;SEZIONE REGIONALE CENTRALE;593FA4F0-BDDA-49F4-B0EA-7A631A4BE3E7;DIREZIONE APPALTI EDILIZIA E PATRIMONIO;2025;2;33112000-8;ECOGRAFI, ULTRASONOGRAFI E APPARECCHI DOPPLER;1;;;;2025-02-14;;;;;;;;1;7.0;NON APPLICABILE;0.0;;80002170720.0;UNIVERSITA' DEGLI STUDI DI BARI ALDO MORO;;;133.18;LA PARTECIPAZIONE NON È RISERVATA.;80002170720202400069;;10.0;NO, NESSUNA IPOTESI DI COLLEGAMENTO;;1.0;AGGIUDICATA;2025-05-28;1;2025;Altre applicazioni IA;Università e Ricerca;True;345133.18;False
B582FB9506;;CONSIP_RDO_5069297;FORNITURA DEL DISPOSITIVO MEDICO SOFTWARE DI INTELLIGENZA ARTIFICIALE OCCORRENTE UOC RADIOLOGIA DEL PO POTENZA;25000.0;1;FORNITURA SOFTWARE INTELLIGENZA ARTIFICIALE;25000.0;FORNITURE;ATTIVO;SETTORI ORDINARI;76063.0;POTENZA;2025-02-05;2025-02-19;23;PROCEDURA NEGOZIATA CON PREVIA INDIZIONE DI GARA (SETTORI SPECIALI);1;CONTRATTO D'APPALTO;174374;1186830764;AZIENDA OSPEDALIERA REGIONALE SAN CARLO;SEZIONE REGIONALE BASILICATA;AD3A0FB0-C79B-401D-AFE8-66A1AAA3CF00;PROVVEDITORATO ECONOMATO AOR SAN CARLO POTENZA;2025;2;33190000-8;DISPOSITIVI E PRODOTTI MEDICI VARI;1;;;;2025-02-05;;;;;;;;1;7.0;NON APPLICABILE;0.0;;1186830764.0;AZIENDA OSPEDALIERA REGIONALE SAN CARLO;;;;LA PARTECIPAZIONE NON È RISERVATA.;;;10.0;NO, NESSUNA IPOTESI DI COLLEGAMENTO;;;;;0;2025;Altre applicazioni IA;Sanità;False;25000.0;False
B5888915F7;;db4dfbf0-8566-4f6f-a049-cfb56106b82c;PROPOSTA PROGETTUALE PER IL RIUTILIZZO DI UN CHATBOT SPERIMENTALE IMPLEMENTATO CON INTELLIGENZA ARTIFICIALE GENERATIVA PER UNA ULTERIORE PROCEDURA CONCORSUALE NONCHÉ INTERVENTI EVOLUTIVI NELL'AMBITO DELLA GESTIONE DEL PERSONALE DELLA SCUOLA;14938.0;1;PROPOSTA PROGETTUALE PER IL RIUTILIZZO DI UN CHATBOT SPERIMENTALE IMPLEMENTATO CON INTELLIGENZA ARTIFICIALE GENERATIVA PER UNA ULTERIORE PROCEDURA CONCORSUALE NONCHÉ INTERVENTI EVOLUTIVI NELL'AMBITO DELLA GESTIONE DEL PERSONALE DELLA SCUOLA;14938.0;SERVIZI;ATTIVO;SETTORI ORDINARI;22205.0;TRENTO;2025-02-07;2025-02-06;25;AFFIDAMENTO DIRETTO A SOCIETA' IN HOUSE;999;ND;164588;337460224;PROVINCIA AUTONOMA DI TRENTO;SEZIONE REGIONALE PROVINCIA AUTONOMA DI TRENTO;6B60DE78-2085-42EA-ACFD-FC4A4E420BD1;DIPARTIMENTO ISTRUZIONE E CULTURA;2025;2;72232000;;1;;;;2025-02-06;;;;;;;;0;;;0.0;;337460224.0;PROVINCIA AUTONOMA DI TRENTO;;;0.0;;;;;;;1.0;AGGIUDICATA;2025-02-06;0;2025;AI Generativa & LLM;PA Locale;False;14938.0;False
B5892FF153;;CONSIP_RDO_5053505;SERVIZIO DI SUPPORTO SPECIALISTICO PROGETTO SPERIMENTAZIONE INTELLIGENZA ARTIFICIALE A SUPPORTO DELL'APPRENDIMENTO PER IL CONTRASTO ALLA DISPERSIONE SCOLASTICA CIRC 22 REGIONE SICILIANA;56557.38;1;SERVIZIO DI SUPPORTO SPECIALISTICO PER LA REALIZZAZIONE DEL PROGETTO SPERIMENTAZIONE INTELLIGENZA ARTIFICIALE;56557.38;SERVIZI;ATTIVO;SETTORI ORDINARI;84001.0;AGRIGENTO;2025-02-07;2025-02-06;24;AFFIDAMENTO DIRETTO;1;CONTRATTO D'APPALTO;319862;80004050847;LICEO SCIENTIFICO STATALE LEONARDO AGRIGENTO;SEZIONE REGIONALE CENTRALE;19F9E103-E69C-44E1-9AFE-4554D7618C4A;UFFICIO D.S E D.S.G.A.;2025;2;79632000-3;SERVIZI DI FORMAZIONE DEL PERSONALE;1;;;;2025-02-06;;;;;;;;1;7.0;non applicabile;0.0;;80004050847.0;LICEO SCIENTIFICO STATALE LEONARDO AGRIGENTO;;;0.0;;;;;;;1.0;AGGIUDICATA;2025-02-06;0;2025;Consulenza IA;Istruzione;False;56557.38;False
B5C58D8C3E;;CONSIP_RDO_5117345;L'AFFIDAMENTO DI UN LABORATORIO FORMATIVO SULL'INTELLIGENZA ARTIFICIALE GENERATIVA E DEL SERVIZIO DI ORGANIZZAZIONE EVENTI DIMOSTRATIVI. CUP C99G23000370002;6000.0;1;L'AFFIDAMENTO DI UN LABORATORIO FORMATIVO SULL'INTELLIGENZA ARTIFICIALE GENERATIVA E DEL SERVIZIO DI ORGANIZZAZIONE EVENTI DIMOSTRATIVI. CUP C99G23000370002;6000.0;SERVIZI;ATTIVO;SETTORI ORDINARI;54039.0;PERUGIA;2025-02-25;2025-02-24;24;AFFIDAMENTO DIRETTO;1;CONTRATTO D'APPALTO;159059;163570542;COMUNE DI PERUGIA;SEZIONE REGIONALE UMBRIA;ABFFB211-E6C8-43AD-BEFD-25EDFF34DC04;U.O. PROGETTI EUROPEI E RELAZIONI INTERNAZIONALI;2025;2;92000000-1;SERVIZI RICREATIVI, CULTURALI E SPORTIVI;1;;;;2025-02-24;;;;;;;;1;7.0;non applicabile;0.0;;163570542.0;COMUNE DI PERUGIA;;;;;;;;;;1.0;AGGIUDICATA;2025-02-24;0;2025;Formazione IA;PA Locale;False;6000.0;False
B5ABA82086;;b66c75de-9f8f-4b8f-a096-f8804ebb75af;AFFIDAMENTO PROGETTO DI INTELLIGENZA ARTIFICIALE APPLICATA ALLE INTERROGAZIONI CONSILIARI;118346.0;1;AFFIDAMENTO PROGETTO DI INTELLIGENZA ARTIFICIALE APPLICATA ALLE INTERROGAZIONI CONSILIARI;118346.0;SERVIZI;ATTIVO;SETTORI ORDINARI;22205.0;TRENTO;2025-02-18;2025-02-17;25;AFFIDAMENTO DIRETTO A SOCIETA' IN HOUSE;999;ND;164588;337460224;PROVINCIA AUTONOMA DI TRENTO;SEZIONE REGIONALE PROVINCIA AUTONOMA DI TRENTO;5A361E32-4440-4B5E-854D-7BC9FC85C443;UMST AFFARI GENERALI PRESIDENZA SEGRETERIA DI GIUNTA E TRASPARENZA.;2025;2;72212000;;1;;;;2025-02-17;;;;;;;;0;;;0.0;;337460224.0;PROVINCIA AUTONOMA DI TRENTO;;;0.0;;;;;;;1.0;AGGIUDICATA;2025-02-17;0;2025;Altre applicazioni IA;PA Locale;False;118346.0;False
B5A39FE295;;CONSIP_RDO_5069301;ATTIVITÀ DI CONSULENZA FINALIZZATA AL POTENZIAMENTO DI SOLUZIONI RIABILITATIVE PERSONALIZZATE ATTRAVERSO INTELLIGENZA ARTIFICIALE (AI) E MACHINE LEARNING;139000.0;1;ATTIVITÀ DI CONSULENZA FINALIZZATA AL POTENZIAMENTO DI SOLUZIONI RIABILITATIVE PERSONALIZZATE ATTRAVERSO INTELLIGENZA ARTIFICIALE (AI) E MACHINE LEARNING;139000.0;SERVIZI;ATTIVO;SETTORI ORDINARI;63049.0;NAPOLI;2025-02-14;2025-02-13;24;AFFIDAMENTO DIRETTO;1;CONTRATTO D'APPALTO;170308;876220633;UNIVERSITA' DEGLI STUDI DI NAPOLI FEDERICO II;SEZIONE REGIONALE CENTRALE;26D1BD2F-E1D3-496C-9C64-30EBE1C06BD3;CENTRO INTERDIPARTIMENTALE DI RICERCA IN CHIRURGIA ROBOTICA - INTERDEPARTMENTAL CENTER FOR ADVANCES IN ROBOTIC SURGERY - ICAROS;2025;2;79311000-7;SERVIZI DI INDAGINE;1;;;;2025-02-13;;;;;;;;1;7.0;non applicabile;0.0;;876220633.0;UNIVERSITA' DEGLI STUDI DI NAPOLI FEDERICO II;;;;;;;;;;1.0;AGGIUDICATA;2025-02-13;1;2025;Machine Learning & Analytics;Università e Ricerca;True;139000.0;False
B589848DD7;;225-13879;AFFIDAMENTO DIRETTO AI SENSI DELL'ART. 50, C.1, LETT.B) DEL D.LGS 36/2023 PER LA FORNITURA DI UN SISTEMA INFORMATICO SOFTWARE E HARDWARE BASATO SULL'INTELLIGENZA ARTIFICIALE DI SUPPORTO PER L'ATTIVITÀ DI MARKETING PER L'ADEMPIMENTO DELLE SEGUENTI ATTIVITÀ: DIGITALIZZAZIONE E ANALISI IN CHIAVE COMMERCIALE DELLO SPAZIO ESPOSITIVO, LA PIANIFICAZIONE DELLE ATTIVITÀ DI DIPENDENTI E COLLABORATORI, L'ANALISI DELLE PERFORMANCE FINANZIARIE, L'UTILIZZO DEL TOOL DI BUSINESS INTELLIGENCE, LA GESTIONE E PIANIFICAZIONE DELLE CAMPAGNE PROMOZIONALI E DEGLI ACCORDI COMMERCIALI CON LE AZIENDE PARTNER, L'ELABORAZIONE DI CAMPAGNE, MATERIALI E DI PIANI DI COMUNICAZIONE CON I CLIENTI DELL'ATTIVITÀ COMMERCIALE E LA PRODUZIONE DI REPORT;10680.0;1;LA FORNITURA DI UN SISTEMA INFORMATICO SOFTWARE E HARDWARE BASATO SULL'INTELLIGENZA ARTIFICIALE DI SUPPORTO PER L'ATTIVITÀ DI MARKETING PER L'ADEMPIMENTO DELLE SEGUENTI ATTIVITÀ: DIGITALIZZAZIONE E ANALISI IN CHIAVE COMMERCIALE DELLO SPAZIO ESPOSITIVO, LA PIANIFICAZIONE DELLE ATTIVITÀ DI DIPENDENTI E COLLABORATORI, L'ANALISI DELLE PERFORMANCE FINANZIARIE, L'UTILIZZO DEL TOOL DI BUSINESS INTELLIGENCE, LA GESTIONE E PIANIFICAZIONE DELLE CAMPAGNE PROMOZIONALI E DEGLI ACCORDI COMMERCIALI CON LE AZIENDE PARTNER, L'ELABORAZIONE DI CAMPAGNE, MATERIALI E DI PIANI DI COMUNICAZIONE CON I CLIENTI DELL'ATTIVITÀ COMMERCIALE E LA PRODUZIONE DI REPORT;10680.0;SERVIZI;ATTIVO;SETTORI ORDINARI;55032.0;TERNI;2025-02-07;2025-02-06;24;AFFIDAMENTO DIRETTO;1;CONTRATTO D'APPALTO;259292;693320558;FARMACIATERNI S.R.L.;SEZIONE REGIONALE UMBRIA;A4D391E7-CF34-4606-9105-9864ED5BF698;AFM;2025;2;48990000-4;PACCHETTI SOFTWARE PER FOGLI DI CALCOLO E POTENZIAMENTO;1;;;;2025-02-06;;;;;;;;1;7.0;non applicabile;0.0;;693320558.0;FARMACIATERNI S.R.L.;;;;;;;;;;1.0;AGGIUDICATA;2025-02-06;0;2025;Formazione IA;Altri Enti Pubblici;False;10680.0;False
B5CF831BB1;;CONSIP_RDO_5121064;AFFIDAMENTO DIRETTO SERVIZIO AL GOVERNANCE - SERVIZIO DI SUPPORTO ALLA REGOLAMENTAZIONE DEGLI STRUMENTI DI INTELLIGENZA ARTIFICIALE ALL'INTERNO DELL'ENTE PER TRE ANNI;7290.0;1;SERVIZIO SUPPORTO AL GOVERNANCE REGOLAMENTAZIONE STRUMENTI INTELLIGENZA ARTIFICIALE;7290.0;SERVIZI;ATTIVO;SETTORI ORDINARI;72015.0;BARI;2025-02-27;2025-02-26;24;AFFIDAMENTO DIRETTO;1;CONTRATTO D'APPALTO;237893;80012570729;COMUNE DI CASAMASSIMA;SEZIONE REGIONALE PUGLIA;D86CEF81-278D-467C-93D0-64D7CF17B793;AFFARI GENERALI;2025;2;79411000-8;SERVIZI GENERALI DI CONSULENZA GESTIONALE;1;;;;2025-02-26;;;;;;;;1;7.0;non applicabile;0.0;;80012570729.0;COMUNE DI CASAMASSIMA;;;0.0;;;;;;;1.0;AGGIUDICATA;2025-02-26;0;2025;AI Ethics & Governance;PA Locale;False;7290.0;False
B570D01C63;;tender://adsppalermo/id/2473;PARTECIPAZIONE DI 58 UNITÀ AL CORSO DI FORMAZIONE APPLICAZIONE DELL'INTELLIGENZA ARTIFICIALE NEL SETTORE PORTUALE;8000.0;1;PARTECIPAZIONE DI 58 UNITÀ AL CORSO APPLICAZIONE DELL'INTELLIGENZA ARTIFICIALE NEL SETTORE PORTUALE;8000.0;SERVIZI;ATTIVO;SETTORI ORDINARI;82053.0;PALERMO;2025-02-05;2025-01-31;24;AFFIDAMENTO DIRETTO;1;CONTRATTO D'APPALTO;154559;117040824;AUTORITA DI SISTEMA PORTUALE DEL MARE DI SICILIA OCCIDENTALE;SEZIONE REGIONALE CENTRALE;E5AE4C63-5DF1-4D23-9D7D-98C8B7DDBD6B;UFFICIO AFFARI GENERALI E DEL PERSONALE;2025;2;80533100-0;SERVIZI DI FORMAZIONE INFORMATICA;1;;;;2025-01-31;;;;;;;;1;7.0;non applicabile;0.0;;117040824.0;AUTORITA' DI SISTEMA PORTUALE DEL MARE DI SICILIA OCCIDENTALE;;;;;;;;;;1.0;AGGIUDICATA;2025-01-31;0;2025;Formazione IA;Altri Enti Pubblici;False;8000.0;False
B5C817936E;;fa8b86ac-1c9c-4e01-9924-f832d5951126;STUDIO SULLE POTENZIALITÀ DELL'INTELLIGENZA ARTIFICIALE PER L'AREA ALPINA NELL'AMBITO DELLA STRATEGIA EUSALP. CUP B74F22015280007. (IMPORTO DA OFFRIRE E RIBASSARE € 62.000 IVA ESCLUSA).;61437.28;1;STUDIO SULLE POTENZIALITÀ DELL'INTELLIGENZA ARTIFICIALE PER L'AREA ALPINA NELL'AMBITO DELLA STRATEGIA EUSALP. CUP B74F22015280007. (IMPORTO DA OFFRIRE E RIBASSARE € 62.000 IVA ESCLUSA).;61437.28;SERVIZI;ATTIVO;SETTORI ORDINARI;7003.0;AOSTA;2025-02-26;2025-02-24;24;AFFIDAMENTO DIRETTO;1;CONTRATTO D'APPALTO;246415;80002270074;REGIONE AUTONOMA VALLE D'AOSTA;SEZIONE REGIONALE VALLE D'AOSTA;F548AB02-5590-429E-85BE-EA8CEBBB5BFD;DIREZIONE SISTEMI TECNOLOGICI;2025;2;72253000;;1;;;;2025-02-24;;;;;;;;1;7.0;non applicabile;0.0;;80002270074.0;REGIONE AUTONOMA VALLE D'AOSTA;;;0.0;;;;;;;1.0;AGGIUDICATA;2025-02-24;0;2025;Altre applicazioni IA;PA Locale;False;61437.28;False
B62013673C;;CONSIP_RDO_5176982;SERVIZI SPECIALISTICI IN MATERIA DI CYBERSECURITY, INTELLIGENZA ARTIFICIALE E PROTEZIONE DEI DATI PERSONALI EFFETTUATI CON STRUMENTI DIGITALI;40000.0;1;SERVIZI SPECIALISTICI IN MATERIA DI CYBERSECURITY, INTELLIGENZA ARTIFICIALE E PROTEZIONE DEI DATI PERSONALI EFFETTUATI CON STRUMENTI DIGITALI;40000.0;SERVIZI;ATTIVO;SETTORI ORDINARI;58091.0;ROMA;2025-03-20;2025-03-19;24;AFFIDAMENTO DIRETTO;1;CONTRATTO D'APPALTO;647593;96446770586;MINISTERO DELL'UNIVERSITA' E DELLA RICERCA;NON CLASSIFICATO;75EFBA4D-B7FB-42B9-9FAF-5797C9651322;DIREZIONE GENERALE DEL PERSONALE DEL BILANCIO E DEI SERVIZI STRUMENTALI;2025;3;79140000-7;SERVIZI DI CONSULENZA E INFORMAZIONE GIURIDICA;1;;;;2025-03-19;;;;;;;;1;7.0;non applicabile;0.0;;96446770586.0;MINISTERO DELL'UNIVERSITA' E DELLA RICERCA;;;0.0;;;;;;;1.0;AGGIUDICATA;2025-03-19;0;2025;Cybersecurity IA;Università e Ricerca;False;40000.0;False
B618336CBC;;CONSIP_RDO_4821614;SERVIZIO AMMINISTRATIVO ALLE ATTIVITA' PROCEDURALI E CONTRATTUALI NELL'AMBITO DELLE ATTIVITA' DELLA UOSD SANITA' DIGITALE E TELEMEDICINA RIENTRANTE NELL'AMBITO PNRR MISSIONE 6 COMPONENTE 1 SUB-INVESTIMENTO 1.2.2.4 INTELLIGENZA ARTIFICIALE DELLA DURATA DI 24 MESI;120000.0;1;SERVIZIO AMMINISTRATIVO ALLE ATTIVITA' PROCEDURALI E CONTRATTUALI NELL'AMBITO DELLE ATTIVITA' DELLA UOSD SANITA' DIGITALE E TELEMEDICINA RIENTRANTE NELL'AMBITO PNRR MISSIONE 6 COMPONENTE 1 SUB-INVESTIMENTO 1.2.2.4 INTELLIGENZA ARTIFICIALE DELLA DURATA DI 24 MESI;120000.0;SERVIZI;ATTIVO;SETTORI ORDINARI;58091.0;ROMA;2025-03-19;2025-03-18;24;AFFIDAMENTO DIRETTO;1;CONTRATTO D'APPALTO;246938;97113690586;AGENZIA NAZIONALE PER I SERVIZI SANITARI REGIONALI;SEZIONE REGIONALE LAZIO;9BDB1BE6-7AD3-4523-A4A0-534987DBB2F5;AGENZIA NAZIONALE PER I SERVIZI SANITARI REGIONALI;2025;3;79111000-5;SERVIZI DI CONSULENZA GIURIDICA;1;;;;2025-03-18;;;;;;;;1;7.0;non applicabile;0.0;;97113690586.0;AGENZIA NAZIONALE PER I SERVIZI SANITARI REGIONALI;;;;;;;;;;1.0;AGGIUDICATA;2025-03-18;0;2025;Healthcare IA;PA Centrale;True;120000.0;False
