cig;cig_accordo_quadro;numero_gara;oggetto_gara;importo_complessivo_gara;n_lotti_componenti;oggetto_lotto;importo_lotto;oggetto_principale_contratto;stato;settore;luogo_istat;provincia;data_pubblicazione;data_scadenza_offerta;cod_tipo_scelta_contraente;tipo_scelta_contraente;cod_modalita_realizzazione;modalita_realizzazione;codice_ausa;cf_amministrazione_appaltante;denominazione_amministrazione_appaltante;sezione_regionale;id_centro_costo;denominazione_centro_costo;anno_pubblicazione;mese_pubblicazione;cod_cpv;descrizione_cpv;flag_prevalente;COD_MOTIVO_CANCELLAZIONE;MOTIVO_CANCELLAZIONE;DATA_CANCELLAZIONE;DATA_ULTIMO_PERFEZIONAMENTO;COD_MODALITA_INDIZIONE_SPECIALI;MODALITA_INDIZIONE_SPECIALI;COD_MODALITA_INDIZIONE_SERVIZI;MODALITA_INDIZIONE_SERVIZI;DURATA_PREVISTA;COD_STRUMENTO_SVOLGIMENTO;STRUMENTO_SVOLGIMENTO;FLAG_URGENZA;COD_MOTIVO_URGENZA;MOTIVO_URGENZA;FLAG_DELEGA;FUNZIONI_DELEGATE;CF_SA_DELEGANTE;DENOMINAZIONE_SA_DELEGANTE;CF_SA_DELEGATA;DENOMINAZIONE_SA_DELEGATA;IMPORTO_SICUREZZA;TIPO_APPALTO_RISERVATO;CUI_PROGRAMMA;FLAG_PREV_RIPETIZIONI;COD_IPOTESI_COLLEGAMENTO;IPOTESI_COLLEGAMENTO;CIG_COLLEGAMENTO;COD_ESITO;ESITO;DATA_COMUNICAZIONE_ESITO;FLAG_PNRR_PNC;anno_dataset;categoria_ai;settore_pa;is_pnrr;importo_corretto;is_outlier
9607720D59;;8906090;SERVIZIO DI RILASCIO DI LICENZA D'USO PER UNA PIATTAFORMA DI CYBER SECURITY DI INTELLIGENZA ARTIFICIALE PER LA ALES S.P.A. E SERVIZI DI SUPPORTO CONNESSI;200000.0;1;SERVIZIO DI RILASCIO DI LICENZA D'USO PER UNA PIATTAFORMA DI CYBER SECURITY DI INTELLIGENZA ARTIFICIALE PER LA ALES S.P.A. E SERVIZI DI SUPPORTO CONNESSI;200000.0;SERVIZI;ATTIVO;SETTORI ORDINARI;58091.0;ROMA;2023-01-17;2023-01-30;4;PROCEDURA NEGOZIATA SENZA PREVIA PUBBLICAZIONE;1;CONTRATTO D'APPALTO;225339;5656701009;ALES ARTE LAVORO E SERVIZI SPA;SEZIONE REGIONALE CENTRALE;91FFF879-57F9-415D-8D4E-BFAC9D589D04;ALES SPA;2023;1;48218000-9;PACCHETTI SOFTWARE PER LA GESTIONE DI LICENZE;1;;;;2023-01-17;;;;;730.0;5.0;PROCEDURE SVOLTE ATTRAVERSO PIATTAFORME TELEMATICHE DI NEGOZIAZIONE ART.58;0;;;;;;;;;;;S05656701009202300002 ;0.0;;;;1.0;AGGIUDICATA;2023-02-24;0;2023;Cybersecurity IA;Altri Enti Pubblici;False;200000.0;False
9557018CBC;;8859684;ACQUISIZIONE DELLA PIATTAFORMA DARKTRACE DI MONITORAGGIO COMPORTAMENTALE DI ANOMALIE DI RETE BASATA SU INTELLIGENZA ARTIFICIALE E MACHINE LEARNING;113200.0;1;ACQUISIZIONE DELLA PIATTAFORMA DARKTRACE DI MONITORAGGIO COMPORTAMENTALE DI ANOMALIE DI RETE BASATA SU INTELLIGENZA ARTIFICIALE E MACHINE LEARNING;113200.0;FORNITURE;ATTIVO;SETTORI ORDINARI;87051.0;CATANIA;2023-01-13;2023-03-01;34;PROCEDURA NEGOZIATA PER AFFIDAMENTI SOTTO SOGLIA;4;CONTRATTO DI CONCESSIONE DI SERVIZI E/O FORNITURE;159709;397470873;CITTA METROPOLITANA DI CATANIA;SEZIONE REGIONALE SICILIA;297352E3-47F6-43AA-BA4B-C35511057B8C;DIPARTIMENTO LL.PP.;2023;1;48213000-4;PACCHETTI SOFTWARE PER MIGLIORARE I SISTEMI OPERATIVI;1;;;;2023-03-07;;;;;365.0;5.0;PROCEDURE SVOLTE ATTRAVERSO PIATTAFORME TELEMATICHE DI NEGOZIAZIONE ART.58;0;;;;;;;;;0.0;;;0.0;;;;1.0;AGGIUDICATA;2023-12-29;0;2023;Machine Learning & Analytics;PA Locale;False;113200.0;False
A02C1A0DA7;;9430876;CORSO DI FORMAZIONE INTELLIGENZA ARTIFICIALE;3000.0;1;CORSO DI FORMAZIONE 'INTELLIGENZA ARTIFICIALE';3000.0;SERVIZI;ATTIVO;SETTORI ORDINARI;1272.0;TORINO;2023-01-23;2023-02-06;1;PROCEDURA APERTA;6;AFFIDAMENTO A CONTRAENTE GENERALE;333975;97550230011;ISTITUTO TECNICO INDUSTRIALE STATALE AMEDEO AVOGADRO;SEZIONE REGIONALE PIEMONTE;6D59FD76-EB41-4EB1-ABCC-80B3B76A65A9;UFFICIO TECNICO;2023;1;80570000-0;SERVIZI DI PERFEZIONAMENTO PERSONALE;1;;;;2023-11-28;;;;;4.0;5.0;PROCEDURE SVOLTE ATTRAVERSO PIATTAFORME TELEMATICHE DI NEGOZIAZIONE ART.58;0;;;;;;;;;0.0;;S97550230011202300002;0.0;;;;;;;1;2023;Formazione IA;Istruzione;True;3000.0;False
A02716F09A;;9411907;CORSO DI FORMAZIONE INTELLIGENZA ARTIFICIALE II;3000.0;1;CORSO DI FORMAZIONE INTELLIGENZA ARTIFICIALE II;3000.0;SERVIZI;ATTIVO;SETTORI ORDINARI;1272.0;TORINO;2023-01-23;2023-02-06;24;AFFIDAMENTO DIRETTO;6;AFFIDAMENTO A CONTRAENTE GENERALE;333975;97550230011;ISTITUTO TECNICO INDUSTRIALE STATALE AMEDEO AVOGADRO;SEZIONE REGIONALE PIEMONTE;6D59FD76-EB41-4EB1-ABCC-80B3B76A65A9;UFFICIO TECNICO;2023;1;79140000-7;SERVIZI DI CONSULENZA E INFORMAZIONE GIURIDICA;1;;;;2023-11-28;;;;;30.0;5.0;PROCEDURE SVOLTE ATTRAVERSO PIATTAFORME TELEMATICHE DI NEGOZIAZIONE ART.58;0;;;;;;;;;0.0;;S97550230011202300002;0.0;;;;;;;1;2023;Formazione IA;Istruzione;True;3000.0;False
96395719A1;;8931222;FORNITURA DI MATERIALE E DISPOSITIVI MEDICI DI USO SPECIALISTICO IN GASTROENTEROLOGIA;6575020.2;115;VIDEOCAPSULA PER L'INDAGINE DELL'INTESTINO TENUE CON SOFTWARE POTENZIATO DA MOTORE CON INTELLIGENZA ARTIFICIALE A RETE NEURALE. POSTAZIONE E SOFTWARE IN COMODATO D'USO.;135000.0;FORNITURE;ATTIVO;SETTORI ORDINARI;;N/D;2023-02-22;2023-03-30;1;PROCEDURA APERTA;1;CONTRATTO D'APPALTO;194453;1886690609;AZIENDA UNITA' SANITARIA LOCALE FROSINONE;SEZIONE REGIONALE LAZIO;F5685BC6-7854-44E7-9FA9-B649A6AD11D6;U.O.C. ACQUISIZIONE BENI E SERVIZI -ECONOMATO;2023;2;33190000-8;DISPOSITIVI E PRODOTTI MEDICI VARI;1;;;;2023-02-27;;;;;1095.0;5.0;PROCEDURE SVOLTE ATTRAVERSO PIATTAFORME TELEMATICHE DI NEGOZIAZIONE ART.58;0;;;;;;;;;;;01886690609202200152;0.0;;;;;;;0;2023;Machine Learning & Analytics;Sanità;False;135000.0;False
9624396ED1;;8920596;SERVIZIO DI CONDUZIONE SISTEMISTICA, MANUTENZIONE ED ASSISTENZA TECNICA SPECIALISTICA FULL-RISK PER 36 MESI E RINNOVO LICENZE SOFTWARE DI INTELLIGENZA ARTIFICIALE RAPIDAI IN DOTAZIONE ALLA U.O.C. DI NEURORADIOLOGIA DELL'A.O.R.N. 'A. CARDARELLI';87000.0;1;SERVIZIO DI CONDUZIONE SISTEMISTICA, MANUTENZIONE ED ASSISTENZA TECNICA SPECIALISTICA FULL-RISK PER 36 MESI E RINNOVO LICENZE SOFTWARE DI INTELLIGENZA ARTIFICIALE RAPIDAI IN DOTAZIONE ALLA U.O.C. DI NEURORADIOLOGIA DELL'A.O.R.N. 'A. CARDARELLI';87000.0;SERVIZI;ATTIVO;SETTORI ORDINARI;63049.0;NAPOLI;2023-02-15;2023-03-01;4;PROCEDURA NEGOZIATA SENZA PREVIA PUBBLICAZIONE;1;CONTRATTO D'APPALTO;230414;6853240635;AZIENDA OSPEDALIERA ANTONIO CARDARELLI;SEZIONE REGIONALE CAMPANIA;73915B9B-5185-4805-87EC-1BC26E35E199;DIREZIONE FUNZIONALE GESTIONE ATTIVITA' TECNICHE;2023;2;72212180-4;SERVIZI DI PROGRAMMAZIONE DI SOFTWARE MEDICALE;1;;;;2023-02-20;;;5.0;GARA INDETTA MEDIANTE AVVISO DI PREINFORMAZIONE;1460.0;5.0;PROCEDURE SVOLTE ATTRAVERSO PIATTAFORME TELEMATICHE DI NEGOZIAZIONE ART.58;0;;;;;;;;;0.0;;0000000000000000000000;1.0;;;;;;;0;2023;Healthcare IA;Sanità;False;87000.0;False
963479110F;;8929866;FORNITURA SERVER RACK GPU PER CREAZIONE DI RETI NEURALI E INTELLIGENZA ARTIFICIALE;48900.0;1;FORNITURA SERVER RACK GPU PER CREAZIONE DI RETI NEURALI E INTELLIGENZA ARTIFICIALE;48900.0;FORNITURE;ATTIVO;SETTORI ORDINARI;58065.0;ROMA;2023-02-02;2023-02-15;24;AFFIDAMENTO DIRETTO;1;CONTRATTO D'APPALTO;247332;97231970589;CONSIGLIO PER LA RICERCA IN AGRIC. E L ANALISI ECON. AGR.;SEZIONE REGIONALE CENTRALE;48380026-C289-4D21-8A9A-B755FD86A9AF;CREA-IT - CENTRO DI RICERCA INGEGNERIA E TRASFORMAZIONI AGROALIMENTARI;2023;2;48820000-2;SERVER;1;;;;2023-02-01;;;7.0;PROCEDURA CHE NON PREVEDE INDIZIONE DI GARA;120.0;3.0;CATALOGO ELETTRONICO ART.57: ACQUISTO DIRETTO;0;;;;;;;;;0.0;;F97231970589202300059;0.0;;;;1.0;AGGIUDICATA;2023-10-17;0;2023;Infrastruttura IA;Altri Enti Pubblici;False;48900.0;False
96416258A5;;8936173;SERVIZIO DI MONITORAGGIO E SENTIMENT ANALYSIS DEGLI EPISODI E CONDOTTE DISCRIMINATORIE POSTE IN ESSERE SUI PRINCIPALI SOCIAL E MEDIA, MEDIANTE L'UTILIZZO DI STRUMENTI INFORMATICI DI INTELLIGENZA ARTIFICIALE E MEDIA MONITORING E RELATIVA REPORTISTICA, A SUPPORTO DEL SERVIZIO DI CONTACT CENTER DELL'UFFICIO;135000.0;1;SERVIZIO DI MONITORAGGIO E SENTIMENT ANALYSIS DEGLI EPISODI E CONDOTTE DISCRIMINATORIE POSTE IN ESSERE SUI PRINCIPALI SOCIAL E MEDIA, MEDIANTE L'UTILIZZO DI STRUMENTI INFORMATICI DI INTELLIGENZA ARTIFICIALE E MEDIA MONITORING E RELATIVA REPORTISTICA, A SUPPORTO DEL SERVIZIO DI CONTACT CENTER DELL'UFFICIO;135000.0;SERVIZI;ATTIVO;SETTORI ORDINARI;58091.0;ROMA;2023-02-06;2023-02-27;29;PROCEDURA AI SENSI DEI REGOLAMENTI DEGLI ORGANI COSTITUZIONALI;1;CONTRATTO D'APPALTO;247826;80188230587;PRESIDENZA DEL CONSIGLIO DEI MINISTRI;SEZIONE REGIONALE CENTRALE;E5A2C479-21FD-4F31-AB81-DBB10DAE7B30;DIPARTIMENTO PER LE PARI OPPORTUNITA' - UFFICIO NAZIONALE ANTIDISCRIMINAZIONI RAZZIALI UNAR;2023;2;73300000-5;PROGETTAZIONE E REALIZZAZIONE DI RICERCA E SVILUPPO;1;;;;2023-02-06;;;;;365.0;5.0;PROCEDURE SVOLTE ATTRAVERSO PIATTAFORME TELEMATICHE DI NEGOZIAZIONE ART.58;0;;;;;;;;;;;S8018823058700005000;0.0;;;;1.0;AGGIUDICATA;2023-09-22;0;2023;NLP & Speech;PA Centrale;False;135000.0;False
968090250E;7665717DC6;8971513;SVILUPPO 'ASSISTENTE VIRTUALE PER LE SEGRETERIE BASATO SU INTELLIGENZA ARTIFICIALE';582377.05;1;SVILUPPO 'ASSISTENTE VIRTUALE PER LE SEGRETERIE BASATO SU INTELLIGENZA ARTIFICIALE';582377.05;SERVIZI;ATTIVO;SETTORI ORDINARI;82053.0;PALERMO;2023-03-23;2023-03-23;27;AFFIDAMENTO DIRETTO IN ADESIONE AD ACCORDO QUADRO/CONVENZIONE;11;CONTRATTO D'APPALTO DISCENDENTE DA ACCORDO QUADRO/CONVENZIONE SENZA SUCCESSIVO CONFRONTO COMPETITIVO;238289;80023730825;UNIVERSITA' DEGLI STUDI DI PALERMO;SEZIONE REGIONALE CENTRALE;732B0B4E-E603-476B-8112-B6E694FC287A;SIA - SISTEMA INFORMATIVO DI ATENEO;2023;3;32429000-6;APPARECCHIATURA DI RETE TELEFONICA;1;;;;2023-04-14;;;;;1461.0;5.0;PROCEDURE SVOLTE ATTRAVERSO PIATTAFORME TELEMATICHE DI NEGOZIAZIONE ART.58;0;;;;;;;;;;;80023730825202300013;0.0;;;;1.0;AGGIUDICATA;2023-04-14;0;2023;AI Generativa & LLM;Università e Ricerca;False;582377.05;False
9793754D76;;9067667;FORNITURA TRIENNALE RELATIVA A LICENZA SOFTWARE DI INTELLIGENZA ARTIFICIALE PER L'OTTIMIZZAZIONE DEL PERCORSO DIAGNOSTICO TERAPEUTICO DELL'ICTUS ISCHEMICO DA DESTINARE ALLE UU.OO. DI NEURORADIOLOGIA E STROKE UNIT;59940.0;1;FORNITURA TRIENNALE RELATIVA A LICENZA SOFTWARE DI INTELLIGENZA ARTIFICIALE PER L'OTTIMIZZAZIONE DEL PERCORSO DIAGNOSTICO TERAPEUTICO DELL'ICTUS ISCHEMICO DA DESTINARE ALLE UU.OO. DI NEURORADIOLOGIA E STROKE UNIT;59940.0;FORNITURE;ATTIVO;SETTORI ORDINARI;;N/D;2023-04-27;2023-05-05;24;AFFIDAMENTO DIRETTO;1;CONTRATTO D'APPALTO;207012;2201130610;AZIENDA OSPEDALIERA SANT ANNA E SAN SEBASTIANO DI CASERTA DI RILIEVO NAZIONALE E DI ALTA SPECIALIZZAZIONE;SEZIONE REGIONALE CAMPANIA;4D2A3ECB-EDE6-4953-BF1C-216595F8050A;UOC TECNOLOGIA OSPEDALIERA INNOVAZIONE TECNOLOGICA ED HTA;2023;4;33190000-8;DISPOSITIVI E PRODOTTI MEDICI VARI;1;;;;2023-07-11;;;;;1095.0;3.0;CATALOGO ELETTRONICO ART.57: ACQUISTO DIRETTO;0;;;;;;;;;0.0;;PROGRAMMAZIONE BIENNAL;0.0;;;;;;;0;2023;Formazione IA;Sanità;False;59940.0;False
98352408CC;;9107913;PROGETTO SPERIMENTALE DI MONITORAGGIO DELL'UTENZA TRAMITE INTELLIGENZA ARTIFICIALE;45000.0;1;PROGETTO SPERIMENTALE DI MONITORAGGIO DELL'UTENZA TRAMITE INTELLIGENZA ARTIFICIALE;45000.0;SERVIZI;ATTIVO;SETTORI ORDINARI;26086.0;TREVISO;2023-05-19;2023-05-26;24;AFFIDAMENTO DIRETTO;1;CONTRATTO D'APPALTO;217655;3084880263;AZIENDA U.L.S.S. N. 2 MARCA TREVIGIANA;SEZIONE REGIONALE VENETO;4D9F0C5F-0B72-48F4-BB69-E0CC3EB0A873;AREA INFORMATICA;2023;5;75122000-7;SERVIZI AMMINISTRATIVI IN CAMPO SANITARIO;1;;;;2023-06-22;;;;;1095.0;5.0;PROCEDURE SVOLTE ATTRAVERSO PIATTAFORME TELEMATICHE DI NEGOZIAZIONE ART.58;0;;;;;;;;;;;;0.0;;;;1.0;AGGIUDICATA;2023-06-22;1;2023;Altre applicazioni IA;Altri Enti Pubblici;True;45000.0;False
9819525061;;9092837;SERVIZIO DI INDAGINE STRUTTURALE CON IMMAGINI E INTELLIGENZA ARTIFICIALE PER IL PERIODO DI UN ANNO DALLA STIPULA DEL CONTRATTO.;98000.0;1;SERVIZIO DI INDAGINE STRUTTURALE CON IMMAGINI E INTELLIGENZA ARTIFICIALE PER IL PERIODO DI UN ANNO DALLA STIPULA DEL CONTRATTO.;98000.0;SERVIZI;ATTIVO;SETTORI SPECIALI;;N/D;2023-05-12;2023-05-17;34;PROCEDURA NEGOZIATA PER AFFIDAMENTI SOTTO SOGLIA;1;CONTRATTO D'APPALTO;216876;4245520376;HERA S.P.A.;SEZIONE REGIONALE CENTRALE;B6FA8659-BEE0-4A26-81E4-89A12B837CF1;HERA SPA;2023;5;90490000-8;SERVIZI DI CONSULENZA PER LE ISPEZIONI DELLE FOGNATURE E IL TRATTAMENTO DELLE ACQUE REFLUE;1;;;;2023-05-12;4.0;PROCEDURA CHE NON PREVEDE INDIZIONE DI GARA;;;365.0;5.0;PROCEDURE SVOLTE ATTRAVERSO PIATTAFORME TELEMATICHE DI NEGOZIAZIONE ART.58;0;;;;;;;;;0.0;;;0.0;;;;1.0;AGGIUDICATA;2023-05-22;0;2023;Altre applicazioni IA;Utilities & Trasporti;False;98000.0;False
9823799763;;9097154;REALIZZAZIONE N. 22 CORSI DI FORMAZIONE PNRR POLO FORMATIVO SDT;88000.0;7;N. 3 CORSI INSEGNAMENTO E APPRENDIMENTO DELL'INTELLIGENZA ARTIFICIALE;12000.0;SERVIZI;ATTIVO;SETTORI ORDINARI;79023.0;CATANZARO;2023-05-15;2023-05-31;24;AFFIDAMENTO DIRETTO;1;CONTRATTO D'APPALTO;601748;97087810798;I.I.S. V. EMANUELE II;NON CLASSIFICATO;806AE8D1-95FE-42CF-AE98-1515CDFF550C;I.I.S. V.EMANUELE II;2023;5;80511000-9;SERVIZI DI FORMAZIONE DEI DIPENDENTI;1;;;;2023-05-15;;;;;548.0;1.0;PROCEDURA SVOLTA IN MODALITÀ TRADIZIONALE O CARTACEA;0;;;;;;;;;;;97087810798202300001;0.0;;;;;;;1;2023;Formazione IA;Istruzione;True;12000.0;False
9826363B43;;9099385;ACQUISTO TECA PER ASSISTENTE VIRTUALE OLOGRAFICO E NOLEGGIO DI SISTEMA DI SVILUPPO DI INTELLIGENZA ARTIFICIALE;18000.0;1;ACQUISTO TECA PER ASSISTENTE VIRTUALE OLOGRAFICO E NOLEGGIO DI SISTEMA DI SVILUPPO DI INTELLIGENZA ARTIFICIALE;18000.0;FORNITURE;ATTIVO;SETTORI ORDINARI;58091.0;ROMA;2023-05-30;2023-06-01;24;AFFIDAMENTO DIRETTO;1;CONTRATTO D'APPALTO;539918;97832870584;DIREZIONE GENERALE MUSEI;SEZIONE REGIONALE CENTRALE;E0D53D36-EFF1-4EAD-A611-0702C336E9BD;DIREZIONE GENERALE MUSEI;2023;5;92521100-0;SERVIZI DI ESPOSIZIONE IN MUSEI;1;;;;2023-05-31;;;7.0;PROCEDURA CHE NON PREVEDE INDIZIONE DI GARA;36.0;5.0;PROCEDURE SVOLTE ATTRAVERSO PIATTAFORME TELEMATICHE DI NEGOZIAZIONE ART.58;0;;;;;;;;;;;;0.0;;;;;;;0;2023;AI Generativa & LLM;Altri Enti Pubblici;False;18000.0;False
98164094F8;;9089352;ACQUISTO N. 20 CORSI MOOC POLO FORMATIVO SDT PNRR;52000.0;10;N. 2 MOOC INSEGNAMENTO E APPRENDIMENTO DELL'INTELLIGENZA ARTIFICIALE;5200.0;FORNITURE;ATTIVO;SETTORI ORDINARI;79023.0;CATANZARO;2023-05-10;2023-05-25;24;AFFIDAMENTO DIRETTO;1;CONTRATTO D'APPALTO;601748;97087810798;I.I.S. V. EMANUELE II;NON CLASSIFICATO;806AE8D1-95FE-42CF-AE98-1515CDFF550C;I.I.S. V.EMANUELE II;2023;5;80511000-9;SERVIZI DI FORMAZIONE DEI DIPENDENTI;1;;;;2023-05-10;;;;;548.0;1.0;PROCEDURA SVOLTA IN MODALITÀ TRADIZIONALE O CARTACEA;0;;;;;;;;;;;97087810798202300001;0.0;;;;;;;1;2023;Formazione IA;Istruzione;True;5200.0;False
984386458D;;9114873;ACQUISTO BENI TECNOLOGICI;90317.54;5;ATTREZZATURE INFORMATICHE PER LABORATORIO DI INTELLIGENZA ARTIFICIALE IOT;7867.26;FORNITURE;ATTIVO;SETTORI ORDINARI;73027.0;TARANTO;2023-05-25;2023-06-13;2;PROCEDURA RISTRETTA;4;CONTRATTO DI CONCESSIONE DI SERVIZI E/O FORNITURE;531781;90229680732;ISTITUTO D'ISTRUZIONE SUPERIORE AUGUSTO RIGHI;SEZIONE REGIONALE CENTRALE;5AAEA322-97A3-457B-B715-F8D95DD6901E;II.SS. RIGHI;2023;5;30236000-2;APPARECCHIATURA INFORMATICA VARIA;1;;;;2023-05-29;;;4.0;GARA INDETTA MEDIANTE BANDO DI GARA;90.0;4.0;CATALOGO ELETTRONICO ART.57: RICHIESTA DI OFFERTA;0;;;;;;;;;;;90229680732202300005;0.0;;;;;;;1;2023;Formazione IA;Istruzione;True;7867.26;False
9863834551;;9134418;AFFIDAMENTO DIRETTO, AI SENSI DELL'ART. 36 COMMA 2 LETTERA A) DEL D.LGS. 50/2016, PER LA FORNITURA DI UN SOFTWARE DI INTELLIGENZA ARTIFICIALE PER IL RILEVAMENTO DELLE ANOMALIE OSSEE DA TRAUMA CHIAMATO BONEVIEW, ALLA SOCIETÀ GLEAMER SAS, NECESSARIO ALLA U.O.C. RADIOLOGIA, PER LA DURATA DI 36 MESI;69000.0;1;AFFIDAMENTO DIRETTO, AI SENSI DELL'ART. 36 COMMA 2 LETTERA A) DEL D.LGS. 50/2016, PER LA FORNITURA DI UN SOFTWARE DI INTELLIGENZA ARTIFICIALE PER IL RILEVAMENTO DELLE ANOMALIE OSSEE DA TRAUMA CHIAMATO BONEVIEW, ALLA SOCIETÀ GLEAMER SAS, NECESSARIO ALLA U.O.C. RADIOLOGIA, PER LA DURATA DI UN ANNO;69000.0;SERVIZI;ATTIVO;SETTORI ORDINARI;58091.0;ROMA;2023-05-15;2023-05-17;24;AFFIDAMENTO DIRETTO;1;CONTRATTO D'APPALTO;228242;6019571006;AZIENDA OSPEDALIERA SANT'ANDREA;SEZIONE REGIONALE LAZIO;1C133F7C-5641-47A9-9FD1-32AA81A7ABA1;SISTEMI INFORMATIVI E TECNOLOGIE AVANZATE;2023;5;72268000-1;SERVIZI DI FORNITURA DI SOFTWARE;1;;;;2023-06-22;;;;;1050.0;5.0;PROCEDURE SVOLTE ATTRAVERSO PIATTAFORME TELEMATICHE DI NEGOZIAZIONE ART.58;0;;;;;;;;;;;;0.0;;;;1.0;AGGIUDICATA;2024-07-23;0;2023;Computer Vision;Sanità;False;69000.0;False
98047710FE;;9079250;REALIZZAZIONE DI UN HACKATHON SULL'UTILIZZO DELL'INTELLIGENZA ARTIFICIALE NEL TURISMO_SEDE CENTRALE_BIA;133000.0;1;REALIZZAZIONE DI UN HACKATHON SULL'UTILIZZO DELL'INTELLIGENZA ARTIFICIALE NEL TURISMO_SEDE CENTRALE_BIA;133000.0;SERVIZI;ATTIVO;SETTORI ORDINARI;58091.0;ROMA;2023-05-09;2023-05-23;24;AFFIDAMENTO DIRETTO;1;CONTRATTO D'APPALTO;722851;17409361007;ENIT S.P.A.;NON CLASSIFICATO;7A46BF5F-512B-4397-9DF7-265DA93489E6;DIREZIONE MARKETING E PROMOZIONE;2023;5;80510000-2;SERVIZI DI FORMAZIONE SPECIALISTICA;1;;;;2023-07-19;;;;;60.0;1.0;PROCEDURA SVOLTA IN MODALITÀ TRADIZIONALE O CARTACEA;0;;;;;;;;;;;;0.0;;;;6.0;ANNULLATA/REVOCATA PRIMA DELL'APERTURA DELLE BUSTE AMMINISTRATIVE;2024-03-22;0;2023;Altre applicazioni IA;PA Centrale;False;133000.0;False
98010290FF;;9075912;AFFIDAMENTO DIRETTO DELLA FORNITURA DI PIATTAFORMA SOFTWARE STAND-ALONE 'TRACE4RESEARCH PREMIUM ©' E SOFTWARE DI INTELLIGENZA ARTIFICIALE 'TRACE4AD ©' NELL'AMBITO DEL PROGETTO SIRPAC, OLTRE A UN SERVIZIO DI MANUTENZIONE DI 27 MESI (DIPARTIMENTO DI SCIENZE BIOMEDICHE PER LA SALUTE.;135850.05;1;AFFIDAMENTO DIRETTO DELLA FORNITURA DI PIATTAFORMA SOFTWARE STAND-ALONE 'TRACE4RESEARCH PREMIUM ©' E SOFTWARE DI INTELLIGENZA ARTIFICIALE 'TRACE4AD ©' NELL'AMBITO DEL PROGETTO SIRPAC (DIPARTIMENTO DI SCIENZE BIOMEDICHE PER LA SALUTE.;135850.05;SERVIZI;ATTIVO;SETTORI ORDINARI;;N/D;2023-05-05;2023-05-10;24;AFFIDAMENTO DIRETTO;1;CONTRATTO D'APPALTO;237830;80012650158;UNIVERSITA' DEGLI STUDI DI MILANO;SEZIONE REGIONALE CENTRALE;DDC78B64-80FF-4F15-8C00-47F77F96971C;DIREZIONE CENTRALE ACQUISTI;2023;5;48180000-3;PACCHETTI SOFTWARE MEDICI;1;;;;2023-05-05;;;;;820.0;5.0;PROCEDURE SVOLTE ATTRAVERSO PIATTAFORME TELEMATICHE DI NEGOZIAZIONE ART.58;0;;;;;;;;;;;;0.0;;;;1.0;AGGIUDICATA;2023-06-22;1;2023;RPA & Automazione;Università e Ricerca;True;135850.05;False
9783558F74;;9058179;APPARECCHI PER INTELLIGENZA ARTIFICIALE, ROBOTICA E DIDATTICA COLLABORATIVA;39900.0;1;APPARECCHI PER INTELLIGENZA ARTIFICIALE, ROBOTICA E DIDATTICA COLLABORATIVA;39900.0;FORNITURE;ATTIVO;SETTORI ORDINARI;96020.0;BIELLA;2023-05-19;2023-05-31;24;AFFIDAMENTO DIRETTO;1;CONTRATTO D'APPALTO;330324;92016710029;ISTITUTO ISTRUZIONE SUPERIORE DEL COSSATESE E VALLESTRONA;SEZIONE REGIONALE PIEMONTE;87E76C32-CF49-4D8E-BFFD-8264638826BF;IIS DEL COSSATESE E VALLESTRONA;2023;5;32323100-4;MONITOR A COLORI;1;;;;2023-05-19;;;7.0;PROCEDURA CHE NON PREVEDE INDIZIONE DI GARA;360.0;4.0;CATALOGO ELETTRONICO ART.57: RICHIESTA DI OFFERTA;0;;;;;;;;;0.0;;00000000000000000000;0.0;;;;;;;1;2023;Formazione IA;Istruzione;True;39900.0;False
9783588838;;9058247;APPARECCHI PER INTELLIGENZA ARTIFICIALE, ROBOTICA E DIDATTICA COLLABORATIVA;48000.0;1;APPARECCHI PER INTELLIGENZA ARTIFICIALE, ROBOTICA E DIDATTICA COLLABORATIVA;48000.0;FORNITURE;ATTIVO;SETTORI ORDINARI;96020.0;BIELLA;2023-05-18;2023-06-01;24;AFFIDAMENTO DIRETTO;1;CONTRATTO D'APPALTO;330324;92016710029;ISTITUTO ISTRUZIONE SUPERIORE DEL COSSATESE E VALLESTRONA;SEZIONE REGIONALE PIEMONTE;87E76C32-CF49-4D8E-BFFD-8264638826BF;IIS DEL COSSATESE E VALLESTRONA;2023;5;32323100-4;MONITOR A COLORI;1;;;;2023-05-18;;;7.0;PROCEDURA CHE NON PREVEDE INDIZIONE DI GARA;360.0;4.0;CATALOGO ELETTRONICO ART.57: RICHIESTA DI OFFERTA;0;;;;;;;;;0.0;;00000000000000000000;0.0;;;;;;;1;2023;Formazione IA;Istruzione;True;48000.0;False
9840365E13;;9112583;SERVIZIO DI MANUTENZIONE ORDINARIA, CORRETTIVA E CONSERVATIVA PER L'APPLICATIVO ZEEROMED E DEL RELATIVO SERVIZIO DI ELABORAZIONE MEDIANTE ALGORITMI DI INTELLIGENZA ARTIFICIALE, PER L'ANALISI PREDITTIVA E L'ELABORAZIONE PRECLINICA DI ESAMI MAMMOGRAFICI, DELLA DITTA O3 ENTERPRISE,PER IL PERIODO DI 12 MESI.;128920.0;1;SERVIZIO DI MANUTENZIONE ORDINARIA, CORRETTIVA E CONSERVATIVA PER L'APPLICATIVO ZEEROMED E DEL RELATIVO SERVIZIO DI ELABORAZIONE MEDIANTE ALGORITMI DI INTELLIGENZA ARTIFICIALE, PER L'ANALISI PREDITTIVA E L'ELABORAZIONE PRECLINICA DI ESAMI MAMMOGRAFICI, DELLA DITTA O3 ENTERPRISE,PER IL PERIODO DI 12 MESI.;128920.0;SERVIZI;ATTIVO;SETTORI ORDINARI;;N/D;2023-05-24;2023-06-01;4;PROCEDURA NEGOZIATA SENZA PREVIA PUBBLICAZIONE;1;CONTRATTO D'APPALTO;217655;3084880263;AZIENDA U.L.S.S. N. 2 MARCA TREVIGIANA;SEZIONE REGIONALE VENETO;C959A925-FAC8-4A3D-8E4D-66E5BB038E1B;AREA APPROVVIGIONAMENTI BENI E SERVIZI;2023;5;72250000-2;SERVIZI DI MANUTENZIONE DI SISTEMI E DI ASSISTENZA;1;;;;2023-05-25;;;;;365.0;5.0;PROCEDURE SVOLTE ATTRAVERSO PIATTAFORME TELEMATICHE DI NEGOZIAZIONE ART.58;0;;;;;;;;;;;S03084880263202300048;0.0;;;;1.0;AGGIUDICATA;2024-12-02;0;2023;Machine Learning & Analytics;Altri Enti Pubblici;False;128920.0;False
99244760AF;;9184918;PNRR - METROFOOD-IT (AVVISO MUR N. 3264/2021). FORNITURA DI UNA PIATTAFORMA DI CALCOLO AD ALTE PRESTAZIONI CON SOFTWARE DI GESTIONE INTEGRATO, PER SIMULAZIONI NUMERICHE AVANZATE E PER ANALISI, PROCESSING E MANAGEMENT DI DATI SU LARGA SCALA CON TECNICHE DI INTELLIGENZA ARTIFICIALE;163390.0;1;PNRR - METROFOOD-IT (AVVISO MUR N. 3264/2021). FORNITURA DI UNA PIATTAFORMA DI CALCOLO AD ALTE PRESTAZIONI CON SOFTWARE DI GESTIONE INTEGRATO, PER SIMULAZIONI NUMERICHE AVANZATE E PER ANALISI, PROCESSING E MANAGEMENT DI DATI SU LARGA SCALA CON TECNICHE DI INTELLIGENZA ARTIFICIALE;163390.0;FORNITURE;ATTIVO;SETTORI ORDINARI;1272.0;TORINO;2023-06-28;2023-07-19;4;PROCEDURA NEGOZIATA SENZA PREVIA PUBBLICAZIONE;1;CONTRATTO D'APPALTO;243571;9261710017;IST.NAZ.LE RICERCA METROLOGICA;SEZIONE REGIONALE CENTRALE;5EE8481F-4B4C-4968-9425-ABFB3E08A241;DIREZIONE GENERALE;2023;6;38970000-5;RICERCA, SPERIMENTAZIONE E SIMULATORI TECNICO-SCIENTIFICI;1;;;;2023-06-28;;;;;90.0;5.0;PROCEDURE SVOLTE ATTRAVERSO PIATTAFORME TELEMATICHE DI NEGOZIAZIONE ART.58;0;;;;;;;;;;;09261710017202200044;0.0;;;;1.0;AGGIUDICATA;2023-09-26;1;2023;Infrastruttura IA;Università e Ricerca;True;163390.0;False
9922129FDC;;9182588;INTERVENTO DI INSTALLAZIONE SECONDA UNITÀ DI REFRIGERAZIONE PRESSO DIPARTIMENTO DI INFORMATICA - C.SO SVIZZERA, 185 - TORINO - CENTRO DI COMPETENZA CALCOLO AD ALTE PRESTAZIONI E INTELLIGENZA ARTIFICIALE - HPC4AI;413807.9;1;INTERVENTO DI INSTALLAZIONE SECONDA UNITÀ DI REFRIGERAZIONE PRESSO DIPARTIMENTO DI INFORMATICA - C.SO SVIZZERA, 185 - TORINO - CENTRO DI COMPETENZA CALCOLO AD ALTE PRESTAZIONI E INTELLIGENZA ARTIFICIALE - HPC4AI;413807.9;LAVORI;ATTIVO;SETTORI ORDINARI;1272.0;TORINO;2023-06-28;2023-07-19;34;PROCEDURA NEGOZIATA PER AFFIDAMENTI SOTTO SOGLIA;1;CONTRATTO D'APPALTO;247879;80088230018;UNIVERSITA' DEGLI STUDI DI TORINO;SEZIONE REGIONALE CENTRALE;7597C198-B9FA-4B46-8389-BBB0E7F3C99A;DIREZIONE EDILIZIA E SOSTENIBILITA;2023;6;45240000-1;LAVORI DI COSTRUZIONE PER OPERE IDRAULICHE;1;;;;2023-06-28;;;;;90.0;5.0;PROCEDURE SVOLTE ATTRAVERSO PIATTAFORME TELEMATICHE DI NEGOZIAZIONE ART.58;0;;;;;;;;;8113.88;;;0.0;;;;1.0;AGGIUDICATA;2023-07-28;0;2023;Infrastruttura IA;Università e Ricerca;False;413807.9;False
9931181DCF;;9190479;GARA TELEMATICA MEPA PER LA FORNITURA IN ACQUISTO DI N. 4 SISTEMI DI INTELLIGENZA ARTIFICIALE PER ENDOSCOPIA COMPATIBILI CON LE COLONNE DI VIDEOENDOSCOPIA IN DOTAZIONE ALL'UOC DI CHIRURGIA DEL PO DI AGRIGENTO;155000.0;2;LOTTO 2 - N. 2 SISTEMI DI INTELLIGENZA ARTIFICIALE PER ENDOSCOPIA COMPATIBILE CON LE COLONNE OLYMPUS;77500.0;FORNITURE;ATTIVO;SETTORI ORDINARI;84001.0;AGRIGENTO;2023-06-28;2023-07-31;34;PROCEDURA NEGOZIATA PER AFFIDAMENTI SOTTO SOGLIA;1;CONTRATTO D'APPALTO;200146;2570930848;AZIENDA SANITARIA PROVINCIALE DI AGRIGENTO;SEZIONE REGIONALE SICILIA;CB617C76-6404-4B44-A3E6-84F8D59BA6A1;SERVIZIO PROVVEDITORATO;2023;6;33120000-7;SISTEMI DI REGISTRAZIONE E DISPOSITIVI DI ESPLORAZIONE;1;;;;2023-07-25;;;;;365.0;5.0;PROCEDURE SVOLTE ATTRAVERSO PIATTAFORME TELEMATICHE DI NEGOZIAZIONE ART.58;0;;;;;;;;;;;F02570930848202200163;0.0;;;;1.0;AGGIUDICATA;2024-11-14;0;2023;Healthcare IA;Sanità;False;77500.0;False
987239808F;;9141990;GARA EUROPEA A PROCEDURA APERTA TELEMATICA, SUDDIVISA IN 14 LOTTI, PER L'ACQUISIZIONE DI ATTREZZATURE VARIE DA FINANZIARE CON FONDI POR CAMPANIA FESR 2014-2020- ASSE I 'RICERCA E INNOVAZIONE' - OBIETTIVO SPECIFICO 1.6 - AZIONE 1.6.1 TITOLO DEL PROGETTO: 'POTENZIAMENTO TECNOLOGICO PER IL MIGLIORAMENTO QUALI-QUANTITATIVO DELL'ATTIVITA' DIAGNOSTICA, TERAPEUTICA E ASSISTENZIALE PER L'ABBATTIMENTO DELLE LISTE DI ATTESA NEL PERIODO POST-COVID';1286898.47;14;N. 1 PIATTAFORMA DI INTELLIGENZA ARTIFICIALE (IA) PER L'ELABORAZIONE DELLE IMMAGINI DIGITALI IN OUTPUT DAGLI ENDOSCOPI;100000.0;FORNITURE;ATTIVO;SETTORI ORDINARI;63049.0;NAPOLI;2023-06-08;2023-06-30;1;PROCEDURA APERTA;1;CONTRATTO D'APPALTO;169491;911350635;FONDAZIONE SENATORE PASCALE-ISTITUTO PER LO STUDIO E LA CURA;SEZIONE REGIONALE CENTRALE;CF429FB1-7785-43DD-AB56-1992165AC83B;U.O.C. PROVVEDITORATO - ECONOMATO;2023;6;38434540-3;APPARECCHIATURE BIOMEDICHE;1;;;;2023-06-15;;;;;15.0;5.0;PROCEDURE SVOLTE ATTRAVERSO PIATTAFORME TELEMATICHE DI NEGOZIAZIONE ART.58;0;;;;;;;;;400.0;;;0.0;;;;1.0;AGGIUDICATA;2023-12-22;0;2023;Healthcare IA;Sanità;False;100000.0;False
98646831F0;;9135222;AFFIDAMENTO DIRETTO, AI SENSI DELL'ART. 1, COMMA 2, LETT. A DEL D.L. 76/2020, DEI SERVIZI DI SUPPORTO SPECIALISTICO PER LA RICERCA IN AMBITO DI INTELLIGENZA ARTIFICIALE E PCI PER ANTENNE 4G-5G;53278.71;2;LOTTO 1: PROGETTAZIONE, SVILUPPO E TEST DI ALGORITMI DI INTELLIGENZA ARTIFICIALE PER L'IDENTIFICAZIONE AUTOMATICA DEI DANNI INTERNI AD ABITAZIONI E DELLE LORO CARATTERISTICHE A PARTIRE DA IMMAGINI DELL'AMBIENTE DOVE SI È VERIFICATO IL SINISTRO;40983.61;SERVIZI;ATTIVO;SETTORI ORDINARI;1272.0;TORINO;2023-06-14;2023-06-22;24;AFFIDAMENTO DIRETTO;1;CONTRATTO D'APPALTO;163050;518460019;POLITECNICO DI TORINO;SEZIONE REGIONALE CENTRALE;283F8A3F-786F-4987-A95F-1FEC2BDD1BB1;AMMINISTRAZIONE CENTRALE;2023;6;73210000-7;SERVIZI DI CONSULENZA NEL CAMPO DELLA RICERCA;1;;;;2023-06-14;;;;;600.0;5.0;PROCEDURE SVOLTE ATTRAVERSO PIATTAFORME TELEMATICHE DI NEGOZIAZIONE ART.58;0;;;;;;;;;;;S00518460019202300084;0.0;;;;1.0;AGGIUDICATA;2024-07-07;0;2023;Consulenza IA;Università e Ricerca;False;40983.61;False
