B2892F25B9;;0583-420;STUDIO DEL SONDAGGIO CULTURA DEL NOTARIATO NELL'ERA DELL'INTELLIGENZA ARTIFICIALE;5000.0;1;STUDIO DEL SONDAGGIO CULTURA DEL NOTARIATO NELL'ERA DELL'INTELLIGENZA ARTIFICIALE;5000.0;SERVIZI;ATTIVO;SETTORI ORDINARI;58091.0;ROMA;2024-07-23;2024-07-22;24;AFFIDAMENTO DIRETTO;1;CONTRATTO D'APPALTO;617301;5364151000;NOTARTEL SPA;NON CLASSIFICATO;BEC6D1D6-6F15-455D-977E-68EAD89D402A;SEDE;2024;7;80000000;Servizi di istruzione e formazione;1;;;;2024-07-22;;;;;;;;1;7.0;;;;;;;;;;;;;;;1.0;AGGIUDICATA;2024-03-29;0;2024;Altre applicazioni IA;Altri Enti Pubblici;False;5000.0;False
B298EDC88D;;CONSIP_RDO_4546866;ACQUISTO FORMAZIONE INTELLIGENZA ARTIFICIALE;7800.0;1;CORSI DI FORMAZIONE;7800.0;SERVIZI;ATTIVO;SETTORI ORDINARI;58091.0;ROMA;2024-07-26;2024-07-25;24;AFFIDAMENTO DIRETTO;1;CONTRATTO D'APPALTO;242416;80236150589;ISTITUTO COMPRENSIVO STATALE DI VIA CASETTA MATTEI 279;SEZIONE REGIONALE LAZIO;B62FFE64-50D9-484D-B7ED-B6CCF49D4358;ISTITUTO COMPRENSIVO STATALE FRATELLI CERVI;2024;7;80500000-9;SERVIZI DI FORMAZIONE;1;;;;2024-07-25;;;;;;;;1;7.0;;;;;;;;0.0;;;;;;;1.0;AGGIUDICATA;2024-07-26;0;2024;Formazione IA;Istruzione;False;7800.0;False
B2561DEF84;;dde0c33f-fed5-439e-bbf6-53e9fa45cdb6@1088-G-1157;T08 - REALIZZAZIONE MODELLO INTELLIGENZA ARTIFICIALE STIMA CONSUMO ENERGETICO;73000.0;1;T08 - REALIZZAZIONE MODELLO INTELLIGENZA ARTIFICIALE STIMA CONSUMO ENERGETICO;73000.0;SERVIZI;ATTIVO;SETTORI ORDINARI;15146.0;MILANO;2024-07-05;2024-07-03;24;AFFIDAMENTO DIRETTO;1;CONTRATTO D'APPALTO;247480;97230720159;AZIENDA TRASPORTI MILANESI S.P.A.;SEZIONE REGIONALE LOMBARDIA;A76EE5A5-CFD8-4445-B66E-08362701AD3F;DIREZIONE ACQUISTI;2024;7;72253000-3;SERVIZI DI ASSISTENZA INFORMATICA E DI SUPPORTO;1;;;;2024-07-03;;;;;;;;1;7.0;non applicabile;0.0;;97230720159.0;AZIENDA TRASPORTI MILANESI S.P.A.;;;0.0;;;;;;;1.0;AGGIUDICATA;2024-07-03;0;2024;Altre applicazioni IA;Altri Enti Pubblici;False;73000.0;False
B24F20EA40;;103fc17e-ff5e-4596-87f6-abdf29f374c0@5-G-1487;AFFIDAMENTO DIRETTO PER REALIZZAZIONE DI PODCAST SULL'INTELLIGENZA ARTIFICIALE;49180.33;1;AFFIDAMENTO DIRETTO PER REALIZZAZIONE DI PODCAST SULL'INTELLIGENZA ARTIFICIALE;49180.33;SERVIZI;ATTIVO;SETTORI ORDINARI;58091.0;ROMA;2024-07-03;2024-07-02;24;AFFIDAMENTO DIRETTO;1;CONTRATTO D'APPALTO;207775;2438750586;ROMA CAPITALE;SEZIONE REGIONALE LAZIO;6C5A2929-4197-4226-91A3-33C4C338F96B;GABINETTO DEL SINDACO;2024;7;79340000-9;SERVIZI PUBBLICITARI E DI MARKETING;1;;;;2024-07-02;;;;;;;;1;7.0;;;;;;;;0.0;;;;;;;1.0;AGGIUDICATA;2024-07-02;0;2024;Altre applicazioni IA;Altri Enti Pubblici;False;49180.33;False
B2A0F9A65B;;CONSIP_ORDINE_7998543;ACQUISTO SERVIZIO DI INTELLIGENZA ARTIFICIALE GENAI MEDIUM;16000.0;1;ACQUISTO DI SERVIZI INTELLIGENZA ARTIFICIALE;16000.0;SERVIZI;ATTIVO;SETTORI ORDINARI;18110.0;PAVIA;2024-07-30;2024-07-29;24;AFFIDAMENTO DIRETTO;1;CONTRATTO D'APPALTO;239657;80007270186;UNIVERSITA' DEGLI STUDI DI PAVIA;SEZIONE REGIONALE CENTRALE;A06E9C29-86F4-4DCE-8713-AD3FB94ABBF2;AREA SISTEMI INFORMATIVI;2024;7;72210000-0;SERVIZI DI PROGRAMMAZIONE DI PRODOTTI SOFTWARE IN PACCHETTI;1;;;;2024-07-29;;;;;;;;1;7.0;;;;;;;;;;;;;;;1.0;AGGIUDICATA;2024-07-29;0;2024;Altre applicazioni IA;Università e Ricerca;False;16000.0;False
B26010233E;;CONSIP_RDO_4499456;SERVIZIO DI FORMAZIONE PER ALL'UTILIZZO DELL'INTELLIGENZA ARTIFICIALE;21000.0;1;FORMAZIONE IA;21000.0;SERVIZI;ATTIVO;SETTORI ORDINARI;27042.0;VENEZIA;2024-07-09;2024-07-08;24;AFFIDAMENTO DIRETTO;1;CONTRATTO D'APPALTO;321183;80009100274;UNIONE REGIONALE DELLE CAMERE DI COMMERCIO I.A.A. DEL VENETO;SEZIONE REGIONALE VENETO;3C3E4DF4-0520-416E-986D-45416B5190A8;UFFICIO AMMINISTRAZIONE;2024;7;80510000-2;SERVIZI DI FORMAZIONE SPECIALISTICA;1;;;;2024-07-08;;;;;;;;1;7.0;NON APPLICABILE;0.0;;80009100274.0;UNIONE REGIONALE DELLE CAMERE DI COMMERCIO I.A.A. DEL VENETO;;;;;;;;;;1.0;AGGIUDICATA;2024-07-08;0;2024;Formazione IA;Altri Enti Pubblici;False;21000.0;False
B2991ACAB6;;CONSIP_RDO_4547106;REALIZZAZIONE DI N. 5 CORSI SUL TEMA :CHI HA PAURA DELL'INTELLIGENZA ARTIFICIALE?UTILIZZI E POTENZIALITA' DIDATTICHE;18660.0;1;CORSO STUDENTI: CHIA HA PAURA DELL'INTELLIGENZA ARTIFICIALE? UTILIZZI E PONTENZIALITA' DIDATTICHE - N. CORSI 5;18660.0;SERVIZI;ATTIVO;SETTORI ORDINARI;33032.0;PIACENZA;2024-07-26;2024-07-25;24;AFFIDAMENTO DIRETTO;1;CONTRATTO D'APPALTO;321251;80009510332;LICEO CLASSICO SCUOLA STATALE;SEZIONE REGIONALE CENTRALE;028B7DD3-C31C-46FD-90ED-E4D8E8E7CA0D;LICEO GINNASIO STATALE MELCHIORRE GIOIA;2024;7;80500000-9;SERVIZI DI FORMAZIONE;1;;;;2024-07-25;;;;;;;;1;7.0;;;;;;;;;;;;;;;1.0;AGGIUDICATA;2024-07-26;0;2024;Formazione IA;Istruzione;False;18660.0;False
B24EFF70C4;;CONSIP_RDO_4485329;FORNITURA DI N. 1 PIATTAFORMA DIGITALE BASTA SU WEB BROWSER PER IL PROCESSAMENTO CON METODI COMPUTAZIONALI E DI INTELLIGENZA ARTIFICIALE DI DATI DI IMAGING XRD E XRF PER LE ATTIVITÃ  DEL PROGETTO PNRR-H2IOSC;30000.0;1;PIATTAFORMA DIGITALE BASTA SU WEB BROWSER PER IL PROCESSAMENTO CON METODI COMPUTAZIONALI E DI INTELLIGENZA ARTIFICIALE DI DATI DI IMAGING XRD E XRF;30000.0;SERVIZI;ATTIVO;SETTORI ORDINARI;87015.0;CATANIA;2024-07-03;2024-07-02;24;AFFIDAMENTO DIRETTO;1;CONTRATTO D'APPALTO;244154;80054330586;CONSIGLIO NAZIONALE DELLE RICERCHE;SEZIONE REGIONALE CENTRALE;FDC6850E-D097-440A-8245-313A2FD39716;ISTITUTO DI SCIENZE DEL PATRIMONIO CULTURALE - ISPC - CATANIA;2024;7;72212325-3;SERVIZI DI PROGRAMMAZIONE DI SOFTWARE PER L'ELABORAZIONE DI MODULI;1;;;;2024-07-02;;;;;;;;1;7.0;;;;;;;;;;;;;;;1.0;AGGIUDICATA;2024-06-24;0;2024;Altre applicazioni IA;Altri Enti Pubblici;True;30000.0;False
B25A3B116B;;CONSIP_ORDINE_7960245;AFFIDAMENTO DIRETTO PER IL RINNOVO DEL SERVIZIO IN MODALITÃ  SAAS DELLO SPORTELLO UNICO DIGITALE DEL CITTADINO INTEGRATO CON PAGOPA-SPID-APP-IO, DI UN SISTEMA DI INTELLIGENZA ARTIFICIALE APPLICATA ALLA PA, PER N. 1 ANNO E L'ADEGUAMENTO DEL TEMPLATE GRAFICO DEI SITI INTERNET ISTITUZIONALE E TURISTICO ALLE NUOVE LINEE GUIDA DI DESIGN PER I SERVIZI WEB;9150.0;1;RINNOVO SITO WEB;9150.0;SERVIZI;ATTIVO;SETTORI ORDINARI;76095.0;POTENZA;2024-07-05;2024-07-04;24;AFFIDAMENTO DIRETTO;1;CONTRATTO D'APPALTO;245939;86000090760;COMUNE DI VENOSA;SEZIONE REGIONALE BASILICATA;6E153434-A35E-4974-912F-49D9F10B9039;AREA VIGILANZA;2024;7;72415000-2;SERVIZI DI HOST PER OPERAZIONI CONNESSE A SITI DEL WORLD WIDE WEB (WWW);1;;;;2024-07-04;;;;;;;;1;7.0;;;;;;;;;;;;;;;1.0;AGGIUDICATA;2024-07-04;0;2024;Altre applicazioni IA;PA Locale;False;9150.0;False
B24FB249BA;;CONSIP_RDO_4483334;SVILUPPO DI UNA APPLICAZIONE DIDATTICA BASATA SU INTELLIGENZA ARTIFICIALE DENOMINATA MLT - RDA 25717 LR;55000.0;1;SVILUPPO DI UNA APPLICAZIONE DIDATTICA BASATA SU INTELLIGENZA ARTIFICIALE DENOMINATA MLT;55000.0;SERVIZI;ATTIVO;SETTORI ORDINARI;15146.0;MILANO;2024-07-03;2024-07-02;24;AFFIDAMENTO DIRETTO;1;CONTRATTO D'APPALTO;244270;80057930150;POLITECNICO DI MILANO;SEZIONE REGIONALE CENTRALE;02ACCB52-10AD-4C53-852C-79A7C5F32130;AREA SERVIZI SUPPORTO ALLA RICERCA;2024;7;72230000-6;SERVIZI DI SVILUPPO DI SOFTWARE PERSONALIZZATI;1;;;;2024-07-02;;;;;;;;1;7.0;;;;;;;;;;;;;;;1.0;AGGIUDICATA;2024-06-10;0;2024;Formazione IA;Università e Ricerca;False;55000.0;False
B24CC21E20;;G01863-1ffee8e3-e7e3-46ab-ae3e-a5d6a0fc0829;CONTRATTO DI RICERCA CONCERNENTE IL TEMA SVILUPPO DI ALGORITMI D'INTELLIGENZA ARTIFICIALE E GESTIONE DI DATI PER L'OTTIMIZZAZIONE DI PROTOCOLLI COMBINATI D'IMPULSI ELETTRICI E RAGGI X NELLA TERAPIA DEL CANCRO;9000.0;1;CONTRATTO DI RICERCA CONCERNENTE IL TEMA SVILUPPO DI ALGORITMI D'INTELLIGENZA ARTIFICIALE E GESTIONE DI DATI PER L'OTTIMIZZAZIONE DI PROTOCOLLI COMBINATI D'IMPULSI ELETTRICI E RAGGI X NELLA TERAPIA DEL CANCRO;9000.0;SERVIZI;ATTIVO;SETTORI ORDINARI;58091.0;ROMA;2024-07-02;2024-07-01;24;AFFIDAMENTO DIRETTO;1;CONTRATTO D'APPALTO;177132;1320740580;AGENZIA NAZIONALE PER LE NUOVE TECNOLOGIE, L'ENERGIA E LO SVILUPPO ECONOMICO SOSTENIBILE (ENEA);SEZIONE REGIONALE CENTRALE;54CB1DB4-EE7F-4B7D-A18C-7E6048BFED36;SSPT;2024;7;73100000-3;SERVIZI DI RICERCA E SVILUPPO SPERIMENTALE;1;;;;2024-07-01;;;;;;;;1;7.0;;;;;;;;;;;;;;;1.0;AGGIUDICATA;2024-07-01;0;2024;Altre applicazioni IA;Università e Ricerca;False;9000.0;False
B19BBC363D;;23A103;FORNITURA DI N. 1 SOFTWARE DI INTELLIGENZA ARTIFICIALE PER IMMAGINI RMN CEREBRALI PER ANALISI SU PAZIENTI CON DECADIMENTO COGNITIVO E SU PAZIENTI AFFETTI DA PATOLOGIE DEMIELINIZZANTI;53000.0;1;FORNITURA DI N. 1 SOFTWARE DI INTELLIGENZA ARTIFICIALE PER IMMAGINI RMN CEREBRALI PER ANALISI SU PAZIENTI CON DECADIMENTO COGNITIVO E SU PAZIENTI AFFETTI DA PATOLOGIE DEMIELINIZZANTI;53000.0;FORNITURE;ATTIVO;SETTORI ORDINARI;28060.0;PADOVA;2024-07-02;2024-05-09;24;AFFIDAMENTO DIRETTO;1;CONTRATTO D'APPALTO;179276;349040287;AZIENDA OSPEDALIERA DI PADOVA;SEZIONE REGIONALE VENETO;AD3DEED3-D789-4093-BF76-E7203F88ABE0;UOC PROVVEDITORATO ECONOMATO E GESTIONE DELLA LOGISTICA;2024;7;99999999;Cpv prevalente non disponibile;1;;;;2024-05-09;;;;;;;;1;7.0;;;;;;;;;;;;;;;1.0;AGGIUDICATA;2024-05-16;0;2024;Altre applicazioni IA;Sanità;False;53000.0;False
B12CC8F496;;497332_10900;RDA 2400388 - REDAZIONE E PRODUZIONE DI UN PODCAST SUL TEMA INTELLIGENZA ARTIFICIALE, TERZA STAGIONE DI CAPIRCI UN TUBO.;25000.0;1;RDA 2400388 - REDAZIONE E PRODUZIONE DI UN PODCAST SUL TEMA INTELLIGENZA ARTIFICIALE, TERZA STAGIONE DI CAPIRCI UN TUBO.;25000.0;SERVIZI;ATTIVO;SETTORI ORDINARI;15146.0;MILANO;2024-07-11;2024-04-09;24;AFFIDAMENTO DIRETTO;1;CONTRATTO D'APPALTO;237688;13187590156;CAP HOLDING S.P.A.;SEZIONE REGIONALE LOMBARDIA;FC0D4484-CD07-4C24-AE20-D740B7678819;CAP HOLDING S.P.A.;2024;7;99999999;Cpv prevalente non disponibile;1;;;;2024-04-09;;;;;;;;1;7.0;;;;;;;;0.0;;;;;;;1.0;AGGIUDICATA;2024-04-08;0;2024;Altre applicazioni IA;Utilities & Trasporti;False;25000.0;False
B26F856D3F;;CONSIP_RDO_4511922;SERVIZIO DI REALIZZAZIONE DELL'OUTPUT DI INTELLIGENZA ARTIFICIALE - GALLERIA NAZIONALE DELL'UMBRIA-INVESTIMENTO PNRR 1.2 M1C3;100000.0;1;SERVIZIO DI REALIZZAZIONE DELL'OUTPUT DI INTELLIGENZA ARTIFICIALE - GALLERIA NAZIONALE DELL'UMBRIA-INVESTIMENTO PNRR 1.2 M1C3;100000.0;SERVIZI;ATTIVO;SETTORI ORDINARI;54039.0;PERUGIA;2024-07-12;2024-07-11;24;AFFIDAMENTO DIRETTO;1;CONTRATTO D'APPALTO;550703;94155480547;GALLERIA NAZIONALE DELL'UMBRIA PERUGIA;SEZIONE REGIONALE CENTRALE;16AB4705-D06E-48CA-B13B-4A0B16425441;MINISTERO BENI E ATTIVITA' CULTURALI E DEL TURISMO GALLERIA NAZIONALE DELL'UMBRIA;2024;7;72200000-7;PROGRAMMAZIONE DI SOFTWARE E SERVIZI DI CONSULENZA;1;;;;2024-07-11;;;;;;;;1;7.0;;;;;;;;;;;;;;;1.0;AGGIUDICATA;2024-09-07;0;2024;Altre applicazioni IA;Altri Enti Pubblici;True;100000.0;False
B2982A4340;;CONSIP_RDO_4546076;SOFTWARE DI INTELLIGENZA ARTIFICIALE PER SCREENING RETINOPATIA DIABETICA;5500.0;1;SOFTARE INTELLIGENZA ARTIFICIALE PER SCREENING RETINOPATIA DIABETICA;5500.0;FORNITURE;ATTIVO;SETTORI ORDINARI;6003.0;ALESSANDRIA;2024-07-26;2024-07-25;24;AFFIDAMENTO DIRETTO;1;CONTRATTO D'APPALTO;189715;1640560064;AZIENDA SANITARIA OSPEDALIERA SS. ANTONIO E BIAGIO E C. ARRIGO;SEZIONE REGIONALE PIEMONTE;DD38486D-D84A-4342-ACEB-5D876B56A8C8;PROVVEDITORATO;2024;7;33100000-1;APPARECCHIATURE MEDICHE;1;;;;2024-07-25;;;;;;;;1;7.0;non applicabile;0.0;;1640560064.0;AZIENDA OSPEDALIERO-UNIVERSITARIA SS.ANTONIO E BIAGIO E C. ARRIGO DI ALESSANDRIA;;;;;;;;;;1.0;AGGIUDICATA;2024-08-30;0;2024;AI Ethics & Governance;Sanità;False;5500.0;False
B1469620F6;;ITS 24-2024;SERVIZIO DI SUPPORTO AL RUP PER LE ATTIVITÀ TECNICO-OPERATIVE RELATIVAMENTE AL COLLAUDO, ALLA VERIFICA DI CONFORMITÀ E ALLA CERTIFICAZIONE DI REGOLARE ESECUZIONE DELL'INSTALLAZIONE DEL LABORATORIO DI ROBOTICA E INTELLIGENZA ARTIFICIALE PRESSO LA FONDAZIONE ITS ACADEMY ANGELO RIZZOLI;11999.0;1;SERVIZIO DI SUPPORTO AL RUP PER LE ATTIVITÀ TECNICO-OPERATIVE RELATIVAMENTE AL COLLAUDO, ALLA VERIFICA DI CONFORMITÀ E ALLA CERTIFICAZIONE DI REGOLARE ESECUZIONE DELL'INSTALLAZIONE DEL LABORATORIO DI ROBOTICA E INTELLIGENZA ARTIFICIALE PRESSO LA FONDAZIONE ITS ACADEMY ANGELO RIZZOLI;11999.0;SERVIZI;ATTIVO;SETTORI ORDINARI;15146.0;MILANO;2024-07-09;2024-04-16;24;AFFIDAMENTO DIRETTO;1;CONTRATTO D'APPALTO;698769;7167930960;ISTITUTO TECNICO SUPERIORE ANGELO RIZZOLI PER LE TECNOLOGIE DELL' INFORMAZIONE E DELLA COMUNICAZIONE;NON CLASSIFICATO;E9D9A73A-BF44-4304-9833-83D545794729;ISTITUTO TECNICO SUPERIORE ANGELO RIZZOLI PER LE TECNOLOGIE DELL' INFORMAZIONE E DELLA COMUNICAZIONE;2024;7;99999999;Cpv prevalente non disponibile;1;;;;2024-04-16;;;;;;;;1;7.0;non applicabile;1.0;Proposta di aggiudicazione;7167930960.0;ISTITUTO TECNICO SUPERIORE ANGELO RIZZOLI PER LE TECNOLOGIE DELL' INFORMAZIONE E DELLA COMUNICAZIONE;CFAVCP-0001289;CENTRALE UNICA DI COMMITTENZA DEL SARONNESE;;;;;;;;1.0;AGGIUDICATA;2024-04-12;1;2024;Formazione IA;Istruzione;True;11999.0;False
B2AA01F93E;;CONSIP_RDO_4560264;IMPLEMENTAZIONE E ADDESTRAMENTO INTELLIGENZA ARTIFICIALE SUI CONTENUTI ELABORATI DAL COMITATO SCIENTIFICO DELL'AVATAR E DELLE MOSTRE MULTIMEDIALI. PROGETTO PON - CONV. ICBSA/LCM - RESP. PROF.SSA PORTOGHESI TUZI;15000.0;1;IMPLEMENTAZIONE E ADDESTRAMENTO INTELLIGENZA ARTIFICIALE SUI CONTENUTI ELABORATI DAL COMITATO SCIENTIFICO DELL'AVATAR E DELLE MOSTRE MULTIMEDIALI. PROGETTO PON - CONV. ICBSA/LCM;15000.0;SERVIZI;ATTIVO;SETTORI ORDINARI;58091.0;ROMA;2024-08-01;2024-07-31;24;AFFIDAMENTO DIRETTO;1;CONTRATTO D'APPALTO;238191;80209930587;UNIVERSITA' DEGLI STUDI DI ROMA 'LA SAPIENZA';SEZIONE REGIONALE CENTRALE;4CA9E8B1-B038-481E-A8A9-574328A60791;DIPARTIMENTO DI LETTERE E CULTURE MODERNE;2024;8;72200000-7;PROGRAMMAZIONE DI SOFTWARE E SERVIZI DI CONSULENZA;1;;;;2024-07-31;;;;;;;;1;7.0;;;;;;;;;;;;;;;1.0;AGGIUDICATA;2024-09-10;0;2024;Altre applicazioni IA;Università e Ricerca;False;15000.0;False
B2B57EC69C;;998930_tender_4793;INTELLIGENZA ARTIFICIALE PER MONITORAGGIO E GESTIONE DATI RETRIBUTIVI;30000.0;1;INTELLIGENZA ARTIFICIALE PER MONITORAGGIO E GESTIONE DATI RETRIBUTIVI;30000.0;SERVIZI;ATTIVO;SETTORI ORDINARI;58091.0;ROMA;2024-08-06;2024-08-05;24;AFFIDAMENTO DIRETTO;1;CONTRATTO D'APPALTO;247804;80199230584;CASSA DEPOSITI E PRESTITI SOCIETA PER AZIONI;SEZIONE REGIONALE CENTRALE;666F39C3-30FE-4903-A07E-580581641735;AREA ACQUISTI;2024;8;48219300-9;PACCHETTI SOFTWARE DI AMMINISTRAZIONE;1;;;;2024-08-05;;;;;;;;1;7.0;;;;;;;;0.0;;;;;;;1.0;AGGIUDICATA;2024-07-30;0;2024;Altre applicazioni IA;Enti Pubblici Economici;False;30000.0;False
B2B3ACDE8A;;258814_tender_524;#FORNITURA IMPLEMENTAZIONE COPILOT PER PROCEDURE AEROPORTUALI POC INTELLIGENZA ARTIFICIALE;25000.0;1;# FORNITURA IMPLEMENTAZIONE COPILOT PER PROCEDURE AEROPORTUALI POC INTELLIGENZA ARTIFICIALE;25000.0;SERVIZI;ATTIVO;SETTORI ORDINARI;27042.0;VENEZIA;2024-08-05;2024-08-31;4;PROCEDURA NEGOZIATA SENZA PREVIA PUBBLICAZIONE;1;CONTRATTO D'APPALTO;202146;2193960271;SAVE S.P.A.;SEZIONE REGIONALE CENTRALE;277;UFFICIO TECNICO;2024;8;48517000-5;PACCHETTI SOFTWARE IT;1;;;;2024-08-05;;;;;;;;0;;;0.0;;2193960271.0;SAVE S.P.A.;;;0.0;LA PARTECIPAZIONE NON È RISERVATA.;;;10.0;NO, NESSUNA IPOTESI DI COLLEGAMENTO;;;;;0;2024;AI Generativa & LLM;Altri Enti Pubblici;False;25000.0;False
B2D8857F50;;bac6a0a0-6029-49bb-8db2-8f49e30a6de9;"PNRR POTENZIAMENTO DELL'OFFERTA DEI SERVIZI DI ISTRUZIONE: DAGLI ASILI NIDO ALLE UNIVERSITÀ INVESTIMENTO 2.1: DIDATTICA DIGITALE INTEGRATA E FORMAZIONE ALLA TRANSIZIONE DIGITALE PER IL PERSONALE SCOLASTICO TITOLO PROGETTO PROGETTO TECHEDDUCATORS - CODICE DI PROGETTO M4C1I2.1-2023-1222-P-35411, CODICE CUP C54D23002610006 L5 - LABORATORIO DI FORMAZIONE SUL CAMPO N. 5: INSEGNARE A PENSARE CON LE MANI ATTRAVERSO SAMLABS; F2 - PERCORSO N. 2 FORMAZIONE SULLA TRANSIZIONE DIGITALE: LA DIDATTICA LABORATORIALE IN MATEMATICA, CONTESTI FISICI E DIGITALI (PER PRIMARIA E SECONDARIA DI PRIMO GRADO). L2 - LABORATORIO DI FORMAZIONE SUL CAMPO N. 2: UTILIZZO DELLA STAMPANTE 3D E DEL RELATIVO SOFTWARE NELLA PRATICA DIDATTICA; L3 - LABORATORIO DI FORMAZIONE SUL CAMPO N. 3: CYBER-SICUREZZA, UTILIZZO SICURO DELLA RETE INTERNET E PREVENZIONE DEL CYBER-BULLISMO, LA COMUNICAZIONE CONSAPEVOLE, UTILIZZO ETICO DELL'INTELLIGENZA ARTIFICIALE;";6441.6;1;"PNRR POTENZIAMENTO DELL'OFFERTA DEI SERVIZI DI ISTRUZIONE: DAGLI ASILI NIDO ALLE UNIVERSITÀ INVESTIMENTO 2.1: DIDATTICA DIGITALE INTEGRATA E FORMAZIONE ALLA TRANSIZIONE DIGITALE PER IL PERSONALE SCOLASTICO TITOLO PROGETTO PROGETTO TECHEDDUCATORS - CODICE DI PROGETTO M4C1I2.1-2023-1222-P-35411, CODICE CUP C54D23002610006 L5 - LABORATORIO DI FORMAZIONE SUL CAMPO N. 5: INSEGNARE A PENSARE CON LE MANI ATTRAVERSO SAMLABS; F2 - PERCORSO N. 2 FORMAZIONE SULLA TRANSIZIONE DIGITALE: LA DIDATTICA LABORATORIALE IN MATEMATICA, CONTESTI FISICI E DIGITALI (PER PRIMARIA E SECONDARIA DI PRIMO GRADO). L2 - LABORATORIO DI FORMAZIONE SUL CAMPO N. 2: UTILIZZO DELLA STAMPANTE 3D E DEL RELATIVO SOFTWARE NELLA PRATICA DIDATTICA; L3 - LABORATORIO DI FORMAZIONE SUL CAMPO N. 3: CYBER-SICUREZZA, UTILIZZO SICURO DELLA RETE INTERNET E PREVENZIONE DEL CYBER-BULLISMO, LA COMUNICAZIONE CONSAPEVOLE, UTILIZZO ETICO DELL'INTELLIGENZA ARTIFICIALE;";6441.6;SERVIZI;ATTIVO;SETTORI ORDINARI;22123.0;TRENTO;2024-08-28;2024-08-27;24;AFFIDAMENTO DIRETTO;1;CONTRATTO D'APPALTO;245163;94024510227;ISTITUTO COMPRENSIVO DI MORI;SEZIONE REGIONALE PROVINCIA AUTONOMA DI TRENTO;C38709D3-9DFF-4AC0-BA44-8B79DCB4BC36;UNICO;2024;8;80510000;;1;;;;2024-08-27;;;;;;;;1;7.0;non applicabile;0.0;;94024510227.0;ISTITUTO COMPRENSIVO DI MORI;;;0.0;;;;;;;1.0;AGGIUDICATA;2024-08-27;1;2024;Formazione IA;Istruzione;True;6441.6;False
B2B26CAAE9;;CONSIP_ORDINE_8007111;ICT0591E24 SERVIZIO DI SUPPORTO SPECIALISTICO PER IL CONSOLIDAMENTO DEL PROGETTO UTILIZZO INTELLIGENZA ARTIFICIALE GENERATIVA;33000.0;1;ICT0591E24 SERVIZIO DI SUPPORTO SPECIALISTICO PER IL CONSOLIDAMENTO ED ESTENSIONE DEL PROTOTIPO DI CHATBOT BASATO SU GENAI E RAG;33000.0;SERVIZI;ATTIVO;SETTORI ORDINARI;58091.0;ROMA;2024-08-05;2024-08-02;24;AFFIDAMENTO DIRETTO;1;CONTRATTO D'APPALTO;160226;405030586;ACI INFORMATICA SOCIETA' PER AZIONI IN BREVE ACI INFORMATICA S.P.A.;SEZIONE REGIONALE CENTRALE;3AA97583-8B03-49C9-801A-FB2ACF949400;DIREZIONE IT OPERATION;2024;8;72000000-5;SERVIZI INFORMATICI: CONSULENZA, SVILUPPO DI SOFTWARE, INTERNET E SUPPORTO;1;;;;2024-08-02;;;;;;;;1;7.0;;;;;;;;;;;;;;;1.0;AGGIUDICATA;2024-08-02;0;2024;AI Generativa & LLM;PA Centrale;False;33000.0;False
B2BAC3220B;;ACQ_111529-32a83d17-f400-464f-9000-fbef428e1665;UPGRADE PIATTAFORMA DI INTELLIGENZA ARTIFICIALE ALGHO - ACQ_111529;14400.0;1;UPGRADE PIATTAFORMA DI INTELLIGENZA ARTIFICIALE ALGHO - ACQ_111529;14400.0;FORNITURE;ATTIVO;SETTORI ORDINARI;1272.0;TORINO;2024-08-08;2024-08-07;24;AFFIDAMENTO DIRETTO;1;CONTRATTO D'APPALTO;231630;7937540016;SOCIETA METROPOLITANA ACQUE TORINO SPA;SEZIONE REGIONALE PIEMONTE;8C03A390-62DE-4324-A3C0-76F935E958B5;DIREZIONE GENERALE;2024;8;48200000-0;PACCHETTI SOFTWARE PER RETI, INTERNET E INTRANET;1;;;;2024-08-07;;;;;;;;1;7.0;non applicabile;0.0;;7937540016.0;SOCIETA METROPOLINA ACQUE TORINO SPA;;;;;;;;;;1.0;AGGIUDICATA;2024-08-07;0;2024;Altre applicazioni IA;Utilities & Trasporti;False;14400.0;False
B2BA10DFA8;;1549de5b-c6e9-4f6f-833a-3e37b4e8329e;GARA N. 932/2024 INDIZIONE DI UNA PROCEDURA DI GARA APERTA, AI SENSI DEGLI ARTT. 71 E 108, COMMA 4, DEL D. LGS. N. 36/2023 E SS.MM.II., FINALIZZATA ALLA FORNITURA DI DISPOSITIVI PER ENDOSCOPIA DIGESTIVA PER LE ESIGENZE DELLA U.O.C. DI GASTROENTEROLOGIA ED ENDOSCOPIA DIGESTIVA DELLA ASL DI PESCARA;11968884.5;218;SISTEMA DI VIDEOCAPSULA PER INTESTINO TENUE DOTATO DI SOFTWARE DI INTELLIGENZA ARTIFICIALE A RETE NEURALE CONVOLUZIONALE.;29650.0;FORNITURE;ATTIVO;SETTORI ORDINARI;68028.0;PESCARA;2024-08-09;2024-10-18;1;PROCEDURA APERTA;1;CONTRATTO D'APPALTO;181920;1397530682;AZIENDA SANITARIA LOCALE PESCARA;SEZIONE REGIONALE ABRUZZO;61546B81-EC05-4001-A96D-A64C0EC5ADF0;UFFICIO APPROVVIGIONAMENTO BENI E SERVIZI;2024;8;33168000-5;APPARECCHI PER ENDOSCOPIA E ENDOCHIRURGIA;1;;;;2024-09-26;;;;;;;;1;7.0;non applicabile;0.0;;1397530682.0;AZIENDA SANITARIA LOCALE PESCARA;;;400.0;LA PARTECIPAZIONE NON È RISERVATA.;;;10.0;NO, NESSUNA IPOTESI DI COLLEGAMENTO;;;;;0;2024;Machine Learning & Analytics;Sanità;False;29650.0;False
B2B25E913F;;G11868-f6d4deca-1913-4f4a-9a73-856a74555cd7;AGGIORNAMENTO SOFTWARE DI INTELLIGENZA ARTIFICIALE PER OCULISTICA - PROF. MASTROPASQUA;5000.0;1;AGGIORNAMENTO SOFTWARE DI INTELLIGENZA ARTIFICIALE PER OCULISTICA - PROF. MASTROPASQUA;5000.0;SERVIZI;ATTIVO;SETTORI ORDINARI;69022.0;CHIETI;2024-08-05;2024-08-02;24;AFFIDAMENTO DIRETTO;1;CONTRATTO D'APPALTO;245230;93002750698;UNIVERSITA DEGLI STUDI G. D ANNUNZIO DI CHIETI - PESCARA;SEZIONE REGIONALE CENTRALE;03355D89-8A7B-452A-B3E6-169143CFCEE2;DIPARTIMENTO DI MEDICINA E SCIENZE DELL'INVECCHIAMENTO;2024;8;72200000-7;PROGRAMMAZIONE DI SOFTWARE E SERVIZI DI CONSULENZA;1;;;;2024-08-02;;;;;;;;1;7.0;non applicabile;0.0;;93002750698.0;UNIVERSITA' DEGLI STUDI G.D'ANNUNZIO DI CHIETI - PESCARA;;;;;;;;;;1.0;AGGIUDICATA;2024-08-02;0;2024;Altre applicazioni IA;Università e Ricerca;False;5000.0;False
B2D630B810;;576627_T24_6729;SUPPORTO INTRODUZIONE SISTEMA DI INTELLIGENZA ARTIFICIALE;10200.0;1;SUPPORTO INTRODUZIONE SISTEMA DI INTELLIGENZA ARTIFICIALE;10200.0;SERVIZI;ATTIVO;SETTORI ORDINARI;37006.0;BOLOGNA;2024-08-26;2024-09-03;4;PROCEDURA NEGOZIATA SENZA PREVIA PUBBLICAZIONE;1;CONTRATTO D'APPALTO;216876;4245520376;HERA S.P.A.;SEZIONE REGIONALE CENTRALE;B6FA8659-BEE0-4A26-81E4-89A12B837CF1;HERA SPA;2024;8;72610000-9;SERVIZI DI ASSISTENZA INFORMATICA PER COMPUTER;1;;;;2024-08-26;;;;;;;;0;;;0.0;;4245520376.0;HERA S.P.A.;;;0.0;LA PARTECIPAZIONE NON È RISERVATA.;;;10.0;NO, NESSUNA IPOTESI DI COLLEGAMENTO;;1.0;AGGIUDICATA;2025-05-09;0;2024;Consulenza IA;Utilities & Trasporti;False;10200.0;False
B2CD4E5A15;;fd9c4fc8-d783-4ad7-8bd8-b40251d2a6b3;RICHIESTA DI OFFERTA PER SERVIZIO DI FORMAZIONE DOCENTI NELL'AMBITO DEL PROGETTO ICVR DIGCOMPEDU – M4C1I2.1-2023-1222-P-33913 (2.1) – PROGETTARE E REALIZZARE UNA DIDATTICAINNOVATIVA CON STRUMENTI E METODOLOGIE DIGITALI E INTELLIGENZA ARTIFICIALE GENERATIVA E COORDINAMENTO COMUNITÀ DI PRATICHE PER L'APPRENDIMENTO;5413.12;1;RICHIESTA DI OFFERTA PER SERVIZIO DI FORMAZIONE DOCENTI NELL'AMBITO DEL PROGETTO ICVR DIGCOMPEDU – M4C1I2.1-2023-1222-P-33913 (2.1) – PROGETTARE E REALIZZARE UNA DIDATTICAINNOVATIVA CON STRUMENTI E METODOLOGIE DIGITALI E INTELLIGENZA ARTIFICIALE GENERATIVA E COORDINAMENTO COMUNITÀ DI PRATICHE PER L'APPRENDIMENTO;5413.12;SERVIZI;ATTIVO;SETTORI ORDINARI;22143.0;TRENTO;2024-08-21;2024-08-20;24;AFFIDAMENTO DIRETTO;1;CONTRATTO D'APPALTO;246664;95013000229;ISTITUTO COMPRENSIVO VAL RENDENA;SEZIONE REGIONALE PROVINCIA AUTONOMA DI TRENTO;A7EC4D42-CFF6-4E70-8C38-A767C7FBFBDB;UNICO;2024;8;79632000;;1;;;;2024-08-20;;;;;;;;1;7.0;non applicabile;0.0;;95013000229.0;ISTITUTO COMPRENSIVO VAL RENDENA;;;0.0;;;;;;;1.0;AGGIUDICATA;2024-08-20;1;2024;Formazione IA;Istruzione;True;5413.12;False
B2E04707EE;;CONSIP_RDO_4602358;CORSI E WORKSHOP DI INTELLIGENZA ARTIFICIALE, REALTÀ VIRTUALE E REALTÀ AUMENTATA 2;8296.0;1;CORSI E WORKSHOP DI INTELLIGENZA ARTIFICIALE, REALTÀ VIRTUALE E REALTÀ AUMENTATA;8296.0;SERVIZI;ATTIVO;SETTORI ORDINARI;58091.0;ROMA;2024-08-30;2024-08-29;24;AFFIDAMENTO DIRETTO;1;CONTRATTO D'APPALTO;333221;97021290586;ISTITUTO COMPRENSIVO VIA GIOVANNI PALOMBINI, 59;SEZIONE REGIONALE CENTRALE;F3D33BD1-FFD5-4C7D-A0CE-28BF6D432791;DIREZIONE AMMINISTRATIVA;2024;8;80500000-9;SERVIZI DI FORMAZIONE;1;;;;2024-08-29;;;;;;;;1;7.0;non applicabile;0.0;;97021290586.0;ISTITUTO COMPRENSIVO GIOVANNI PALOMBINI;;;;;;;;;;1.0;AGGIUDICATA;2024-08-29;0;2024;Altre applicazioni IA;Istruzione;False;8296.0;False
B2E14BA91F;;CONSIP_RDO_4578461;FORNITURA DI N 2 WORKSTATION FISSE E DI N 1 WORKSTATION PORTATILE FINALIZZATA ALLO SVILUPPO DI MODELLI DI INTELLIGENZA ARTIFICIALE BASATI SU MODELLI DI DEEP LEARNING PROGETTO DI RICERCA PIANO OPERATIVO SALUTE FSC 2014 2020 PHARMAHUB CUP E63C22001680001;24440.0;1;FORNITURA DI 2 WORKSTATION FISSE E DI 1 WORKSTATION PORTATILE FINALIZZATA ALLO SVILUPPO DI MODELLI DI INTELLIGENZA ARTIFICIALE BASATI SU MODELLI DI DEEP LEARNING;24440.0;FORNITURE;ATTIVO;SETTORI ORDINARI;87015.0;CATANIA;2024-08-30;2024-08-29;24;AFFIDAMENTO DIRETTO;1;CONTRATTO D'APPALTO;205151;2772010878;UNIVERSITA DEGLI STUDI DI CATANIA;SEZIONE REGIONALE CENTRALE;EC81E73A-23F0-4713-A560-D5BFDCFE6E79;DIPARTIMENTO DI MEDICINA CLINICA E SPERIMENTALE;2024;8;30200000-1;APPARECCHIATURE INFORMATICHE E FORNITURE;1;;;;2024-08-29;;;;;;;;1;7.0;non applicabile;0.0;;2772010878.0;UNIVERSITA' DEGLI STUDI DI CATANIA;;;;;;;;;;1.0;AGGIUDICATA;2024-08-29;0;2024;Machine Learning & Analytics;Università e Ricerca;False;24440.0;False
B2E10F4BF3;;CONSIP_RDO_4595777;AFFIDAMENTO MOOC UTILIZZO DELL'INTELLIGENZA ARTIFICIALE NELL'AREA AMMINISTRATIVA DELLA SCUOLA;13000.0;1;MOOC;13000.0;SERVIZI;ATTIVO;SETTORI ORDINARI;10025.0;GENOVA;2024-08-30;2024-08-29;24;AFFIDAMENTO DIRETTO;1;CONTRATTO D'APPALTO;323345;80046950103;ISTITUTO PROFESSIONALE DI STATO PER IND. E ART. A.ODERO;SEZIONE REGIONALE CENTRALE;94ED5A88-E6FC-4FF4-A736-AD5A661EB96B;I.P.S.S.I.A. ATTILIO ODERO;2024;8;79632000-3;SERVIZI DI FORMAZIONE DEL PERSONALE;1;;;;2024-08-29;;;;;;;;1;7.0;non applicabile;0.0;;80046950103.0;ISTITUTO PROFESSIONALE DI STATO PER IND. E ART. A.ODERO;;;;;;;;;;1.0;AGGIUDICATA;2024-08-29;1;2024;Formazione IA;Istruzione;True;13000.0;False
